Unnamed: 0,Date,Headline,Author,Eyebrow,Link,Stock
237,17-Feb-21,"For Griffin’s Return to Washington, Citadel Is a ‘Bigger Target’",By Tracy Alloway,politics,https://www.bloomberg.com/news/articles/2021-02-17/for-griffin-s-return-to-washington-citadel-is-a-bigger-target,GME
238,20-Feb-21,Powell May Be Dovish in Congress Debut of Biden Era: Eco Week,By Tae Kim,markets,https://www.bloomberg.com/news/articles/2021-02-20/powell-may-be-dovish-in-congress-debut-of-biden-era-eco-week,GME
239,20-Feb-21,Your Weekend Reading Newsletter: Hard Lessons From a Texas-Sized Storm,By Robert Schmidt and Jeff Kearns,business,https://www.bloomberg.com/news/newsletters/2021-02-20/your-weekend-reading-newsletter-hard-lessons-from-a-texas-sized-storm,GME
240,19-Feb-21,Billionaire Peterffy Says N.Y. Rich in Florida Are There to Stay,By Dorothy Gambrell,wealth,https://www.bloomberg.com/news/articles/2021-02-19/billionaire-peterffy-says-n-y-rich-in-florida-are-there-to-stay,GME
241,16-Feb-21,Goldman Adds Robo-Adviser to Marcus Consumer Brand,By Mark Gongloff,opinion,https://www.bloomberg.com/opinion/articles/2021-02-16/goldman-adds-robo-adviser-to-marcus-consumer-brand,GME
242,16-Feb-21,How Wall Street Firms Make Billions Off Retail Trades,By Daniel Avis,markets,https://www.bloomberg.com/news/videos/2021-02-17/how-wall-street-firms-make-billions-off-retail-trades-video,GME
243,16-Feb-21,Goldman Sachs Aims to Counter Reddit Trading Frenzy With Marcus Invest,By Andreea Papuc and Cormac Mullen,opinion,https://www.bloomberg.com/opinion/articles/2021-02-16/goldman-sachs-aims-to-counter-reddit-trading-frenzy-with-marcus-invest,GME
244,18-Feb-21,Baystate Business: Website Woes (Radio),By Joe Weisenthal and Tracy Alloway,business,https://www.bloomberg.com/news/audio/2021-02-18/baystate-business-website-woes-radio,GME
245,19-Feb-21,Robinhood CEO’s Five-Hour Ordeal Is Capped by Ocasio-Cortez Duel,By Bailey Lipschultz,wealth,https://www.bloomberg.com/news/articles/2021-02-19/robinhood-ceo-s-five-hour-ordeal-is-capped-by-ocasio-cortez-duel,GME
246,16-Feb-21,"Robinhood Hearing to Draw CEO, Wall Street Execs to Capitol Hill",By Ronojoy Mazumdar,markets,https://www.bloomberg.com/news/videos/2021-02-16/robinhood-hearing-to-draw-ceo-wall-street-execs-to-capitol-hill-video,GME
247,19-Feb-21,Your Evening Briefing Newsletter: Biden Resets Foreign Policy Approach With G7,By Brooke Sample,business,https://www.bloomberg.com/news/newsletters/2021-02-19/your-evening-briefing-newsletter-biden-resets-foreign-policy-approach-with-g7,GME
248,18-Feb-21,Ocasio-Cortez Questions If Free Robinhood Trades Are Really Free,By Abhishek Vishnoi,markets,https://www.bloomberg.com/news/articles/2021-02-18/ocasio-cortez-questions-if-free-robinhood-trades-are-really-free,GME
249,16-Feb-21,Penny Stock Craze at Boiling Point With SEC Eyeing Social Media,By Kristine Owram and Jennifer Bissell-Linsk,markets,https://www.bloomberg.com/news/articles/2021-02-16/penny-stock-craze-at-boiling-point-with-sec-eyeing-social-media,GME
250,19-Feb-21,Covid Is Delaying All the Video Games,By Tom Maloney and Hema Parmar,business,https://www.bloomberg.com/news/newsletters/2021-02-19/covid-is-delaying-all-the-video-games,GME
251,18-Feb-21,"AMC Shares Spike Again, This Time on Months-Old Speculation",By Yueqi Yang,markets,https://www.bloomberg.com/news/articles/2021-02-18/amc-shares-spike-again-this-time-on-months-old-deal-speculation,GME
252,18-Feb-21,Robinhood Rival Webull Raises New Funds at $1 Billion Valuation,By Peter Coy,markets,https://www.bloomberg.com/news/articles/2021-02-18/robinhood-rival-webull-raises-new-funds-at-1-billion-valuation,GME
253,19-Feb-21,"Stock Markets Today: Covax boost, pipeline sanctions, Uber ruling",By Peter Coy,markets,https://www.bloomberg.com/news/newsletters/2021-02-19/stock-markets-today-covax-boost-pipeline-sanctions-uber-ruling,GME
254,19-Feb-21,Michael Klein's $CCIV Hits SPAC Jackpot With Reddit-Adored Lucid,By Suzanne Woolley,opinion,https://www.bloomberg.com/opinion/articles/2021-02-19/michael-klein-s-cciv-hits-spac-jackpot-with-reddit-adored-lucid,GME
255,17-Feb-21,"Robinhood’s Ties to Hedge Funds Still Not Clear, Warren Says",By Paul Jarvis,politics,https://www.bloomberg.com/news/articles/2021-02-17/robinhood-s-ties-to-hedge-funds-still-not-clear-warren-says-kl9jf1f0,GME
256,19-Feb-21,Personal Finance: Mutual Funds Are Not Long for This ETF World,By Matthew S Levine,opinion,https://www.bloomberg.com/opinion/articles/2021-02-19/personal-finance-mutual-funds-are-not-long-for-this-etf-world,GME
257,18-Feb-21,Robinhood’s Trading Limits Send Users Into Small Brokers’ Arms,By Cormac Mullen,markets,https://www.bloomberg.com/news/articles/2021-02-18/robinhood-s-trading-limits-send-users-into-small-brokers-arms,GME
258,17-Feb-21,"Coordinating Trades on Reddit Could Be Manipulation, EU Warns",By Mark Gongloff,markets,https://www.bloomberg.com/news/articles/2021-02-17/coordinating-trades-on-reddit-could-be-manipulation-eu-warns,GME
259,18-Feb-21,The Reflation Bubble's Final Paroxysm May Be Months Away,By Erik Schatzker,opinion,https://www.bloomberg.com/opinion/articles/2021-02-18/the-reflation-bubble-s-final-paroxysm-may-be-months-away,GME
260,17-Feb-21,Cryptocurrency Sleuths Point to Robinhood as Dogecoin Whale,By Lorcan Roche Kelly,markets,https://www.bloomberg.com/news/articles/2021-02-17/cryptocurrency-sleuths-point-to-robinhood-as-dogecoin-whale,GME
261,16-Feb-21,Bloomberg Opinion Radio: Weekend Edition for 2-12-21 (Podcast),By John Authers,business,https://www.bloomberg.com/news/audio/2021-02-16/bloomberg-opinion-radio-weekend-edition-for-2-12-21-podcast,GME
262,17-Feb-21,Your Evening Briefing: Robinhood CEO Denies He Was Helping Hedge Funds,By Katherine Greifeld,business,https://www.bloomberg.com/news/newsletters/2021-02-17/your-evening-briefing-robinhood-ceo-denies-he-was-helping-hedge-funds,GME
263,18-Feb-21,Christie’s Beeple Auction Will Accept Ether Cryptocurrency Payment,By Kristine Owram,pursuits,https://www.bloomberg.com/news/articles/2021-02-18/christie-s-beeple-auction-will-accept-ether-cryptocurrency-payment,GME
264,18-Feb-21,Investment Ideas: New Spots Retail Traders Flock to Talk Stocks,By Edward Johnson,wealth,https://www.bloomberg.com/news/newsletters/2021-02-18/investment-ideas-new-spots-retail-traders-flock-to-talk-stocks,GME
265,17-Feb-21,Plus500 Succumbs to Winning Retail Trades With Hedging Plan,By Joe Easton,markets,https://www.bloomberg.com/news/articles/2021-02-17/retail-investors-pile-into-derivatives-on-plus500-trade-platform,GME
266,18-Feb-21,Facebook Fires a Global Warning Shot,By Adrian Kennedy,politics,https://www.bloomberg.com/news/newsletters/2021-02-18/facebook-fires-a-global-warning-shot,GME
267,16-Feb-21,Goldman Adds Robo-Adviser to Marcus Consumer Brand,By Andrew Mach,business,https://www.bloomberg.com/news/newsletters/2021-02-16/goldman-adds-robo-adviser-to-marcus-consumer-brand-kl8af75g,GME
268,17-Feb-21,Robinhood Misses IRS Deadline to Give Customers Their Tax Forms,By Tugce Ozsoy and Asli Kandemir,wealth,https://www.bloomberg.com/news/articles/2021-02-17/robinhood-misses-irs-deadline-to-give-customers-their-tax-forms,GME
269,17-Feb-21,Covid Relief Stimulus Checks Can Ease Economic Limbo,By Matthew S Levine,opinion,https://www.bloomberg.com/opinion/articles/2021-02-17/covid-relief-stimulus-checks-can-ease-economic-limbo,GME
270,16-Feb-21,Warren Buffett's Berkshire Hathaway Isn't Bullish or Bearish,By Niall Ferguson,opinion,https://www.bloomberg.com/opinion/articles/2021-02-17/warren-buffett-s-berkshire-hathaway-isn-t-bullish-or-bearish,GME
271,17-Feb-21,Reddit Is Chief Suspect as Volatility ETF Swells to $2.6 Billion,By Mark Gilbert,markets,https://www.bloomberg.com/news/articles/2021-02-17/reddit-is-chief-suspect-as-volatility-etf-swells-to-2-6-billion,GME
272,12-Feb-21,"Citadel’s Griffin, Robinhood CEO to Testify at GameStop Hearing",By Anuchit Nguyen and Julia Fioretti,markets,https://www.bloomberg.com/news/articles/2021-02-13/citadel-s-griffin-robinhood-ceo-to-testify-on-gamestop-feb-18,GME
273,16-Feb-21,Bezos Reclaims Title of World’s Richest After Musk Slips,By Kurt Wagner,wealth,https://www.bloomberg.com/news/articles/2021-02-16/bezos-reclaims-title-of-world-s-richest-person-after-musk-slips,GME
274,12-Feb-21,Palihapitiya Explains How GameStop Showed Up Wall Street,By Michelle Leder,markets,https://www.bloomberg.com/news/videos/2021-02-12/palihapitiya-explains-how-gamestop-showed-up-wall-street-video,GME
275,16-Feb-21,GMO's Inker Blames the Fed for the Asset Bubble,By Katharine Gemmell and Charlie Wells,opinion,https://www.bloomberg.com/opinion/articles/2021-02-16/gmo-s-inker-blames-the-fed-for-the-asset-bubble,GME
276,16-Feb-21,BlackRock Silver ETF Adds Warning on Shortages as Investors Bail,By Shuli Ren,markets,https://www.bloomberg.com/news/articles/2021-02-16/blackrock-silver-etf-adds-new-warning-label-as-investors-bail,GME
277,12-Feb-21,GameStop Black Swan Deserves Attention From Market Regulators,By Misyrlena Egkolfopoulou and Julia Fanzeres,opinion,https://www.bloomberg.com/opinion/articles/2021-02-12/gamestop-black-swan-deserves-attention-from-market-regulators,GME
278,16-Feb-21,"Hiding in Hotel, Robinhood CEO Prepares for Political Face-Off",By Mohamed Aly El-Erian,markets,https://www.bloomberg.com/news/articles/2021-02-16/hiding-in-hotel-robinhood-ceo-prepares-for-political-face-off,GME
279,17-Feb-21,Stocks' Big Reflation Bet Sees Virus Victory as Assured,By David Rovella,opinion,https://www.bloomberg.com/opinion/articles/2021-02-17/stocks-big-reflation-bet-sees-virus-victory-as-assured,GME
280,16-Feb-21,We’re Gonna Need a Better Power Grid,By Annie Massa,opinion,https://www.bloomberg.com/opinion/articles/2021-02-16/we-re-gonna-need-a-better-power-grid,GME
281,11-Feb-21,"GameStop Hearings Are Premature, Says Former SEC Head",By Yueqi Yang,business,https://www.bloomberg.com/news/videos/2021-02-11/gamestop-hearings-are-premature-says-former-sec-head-video,GME
282,12-Feb-21,"Robinhood, Citadel, Reddit Executives Testify at GameStop Hearing",By Matthew S Levine,politics,https://www.bloomberg.com/news/live-blog/2021-02-12/robinhood-citadel-reddit-executives-testify-at-gamestop-hearing,GME
283,16-Feb-21,Financial Reform Priorities for the Biden Administration,By Yueqi Yang,opinion,https://www.bloomberg.com/opinion/articles/2021-02-16/financial-reform-priorities-for-the-biden-administration,GME
284,16-Feb-21,"With Lobbying Clout, Big Pot Is Here: Cannabis Weekly",By Matthew S Levine,business,https://www.bloomberg.com/news/articles/2021-02-14/with-new-lobbying-clout-big-pot-has-arrived-cannabis-weekly,GME
285,16-Feb-21,Clubhouse App Emerging as Anti Reddit Forum for Stock Tips and Investing Advice,By Matthew S Levine,wealth,https://www.bloomberg.com/news/articles/2021-02-16/best-stock-tips-hot-new-clubhouse-app-is-anti-reddit-forum-for-investing-buffs,GME
286,11-Feb-21,Why GameStop Didn't Sell Any Stock During the Reddit Rally,By Matthew S Levine,opinion,https://www.bloomberg.com/opinion/articles/2021-02-11/why-gamestop-didn-t-sell-any-stock-during-the-reddit-rally,GME
287,11-Feb-21,Why GameStop Didn't Sell Any Stock During the Reddit Rally,By Matthew S Levine,business,https://www.bloomberg.com/news/newsletters/2021-02-11/why-gamestop-didn-t-sell-any-stock-during-the-reddit-rally-kl14hqg1,GME
288,14-Feb-21,SPACs Are the Big Story With a Lot of Big Questions for Investors,By Matthew S Levine,opinion,https://www.bloomberg.com/opinion/articles/2021-02-14/spacs-are-the-big-story-with-a-lot-of-big-questions-for-investors,GME
289,10-Feb-21,Crypto Mogul Bets on ‘Meme Investing’ With Millions in GameStop,By Vlad Savov and Marika Katanuma,wealth,https://www.bloomberg.com/news/articles/2021-02-10/crypto-mogul-bets-on-meme-investing-with-millions-in-gamestop,GME
290,10-Feb-21,GameStop May Thrive After Gamestonk Saga Thanks to Chewy's Founder,By Vildana Hajric and Claire Ballentine,opinion,https://www.bloomberg.com/opinion/articles/2021-02-10/gamestop-may-thrive-after-gamestonk-saga-thanks-to-chewy-s-founder,GME
291,10-Feb-21,Citadel’s Griffin Expected to Testify at House GameStop Hearing,By Priya Anand,markets,https://www.bloomberg.com/news/articles/2021-02-10/citadel-s-griffin-expected-to-testify-at-house-gamestop-hearing,GME
292,11-Feb-21,"How Elon Musk’s Tweets Moved GameStop (GME), Bitcoin, Dogecoin, and Other Stocks",By Sarah Ponczek and Michael P Regan,businessweek,https://www.bloomberg.com/news/articles/2021-02-11/how-elon-musk-s-tweets-moved-gamestop-gme-bitcoin-dogecoin-and-other-stocks,GME
293,10-Feb-21,Your Guide to Day Trading in a Post-Gamestop World,By Cristin Flanagan,business,https://www.bloomberg.com/news/videos/2021-02-10/your-guide-to-day-trading-in-a-post-gamestop-world-video,GME
294,10-Feb-21,"WallStreetBets GameStop, Dogecoin, Bitcoin Pumping Nothing New",By Catarina Saraiva,opinion,https://www.bloomberg.com/opinion/articles/2021-02-10/wallstreetbets-gamestop-dogecoin-bitcoin-pumping-nothing-new,GME
295,10-Feb-21,"GameStop Revives Fights Over Stock Tax, HFT Firms Buying Orders",By John Authers,wealth,https://www.bloomberg.com/news/articles/2021-02-10/gamestop-revives-fights-over-stock-tax-hft-firms-buying-orders,GME
296,14-Feb-21,Five Things You Need to Know to Start Your Day,By Abhishek Vishnoi,business,https://www.bloomberg.com/news/newsletters/2021-02-14/five-things-you-need-to-know-to-start-your-day,GME
297,11-Feb-21,Biggest Risk to Economy is Over Financialization of Wall St.: Rep. Ro Khanna,By Nir Kaissar,politics,https://www.bloomberg.com/news/videos/2021-02-11/biggest-risk-to-economy-is-over-financialization-of-wall-st-rep-ro-khanna-video,GME
298,13-Feb-21,Mike Novogratz on When the Big Money Will Flow Into Crypto,By Mark Gongloff,business,https://www.bloomberg.com/news/audio/2021-02-13/mike-novogratz-on-when-the-big-money-will-flow-into-crypto,GME
299,9-Feb-21,"GameStop Selloff Deepens, Erasing $30 Billion in Value From Peak",By Spencer Norris,markets,https://www.bloomberg.com/news/articles/2021-02-09/gamestop-selloff-deepens-erasing-30-billion-in-value-from-peak,GME
300,9-Feb-21,Stock-Market Warning System From India Curbs GameStop-Like Gains,By Tracy Alloway and Joe Weisenthal,markets,https://www.bloomberg.com/news/articles/2021-02-10/stock-market-warning-system-from-india-curbs-gamestop-like-gains,GME
301,13-Feb-21,"Elon Musk Tweets, Tesla Inevitably Buys Bitcoin",By Aaron Brown,opinion,https://www.bloomberg.com/opinion/articles/2021-02-13/elon-musk-tweets-tesla-inevitably-buys-bitcoin,GME
302,9-Feb-21,Landseer's Graham Says Reddit Isn't 'Sole Driver' of GameStop,By Olga Kharif,business,https://www.bloomberg.com/news/videos/2021-02-09/landseer-s-graham-says-reddit-isn-t-sole-driver-of-gamestop-video,GME
303,9-Feb-21,Redditors’ Plan to Use GameStop Playbook in Gloves Unravels,By Tracy Alloway and Joe Weisenthal,wealth,https://www.bloomberg.com/news/articles/2021-02-09/redditors-plan-to-use-gamestop-playbook-in-gloves-unravels,GME
304,10-Feb-21,Tilray Surges as Reddit Crowd Turns Its Attention to Pot,By Edvard Pettersson,markets,https://www.bloomberg.com/news/articles/2021-02-10/tilray-heads-for-best-3-day-gain-ever-as-pot-stocks-surge,GME
305,10-Feb-21,Tron Founder Justin Sun Bets on ‘Meme Investing’,By Tyler Cowen,markets,https://www.bloomberg.com/news/videos/2021-02-11/tron-founder-justin-sun-bets-on-meme-investing-video,GME
306,10-Feb-21,Chase Coleman Leads $23 Billion Payday for 15 Hedge Fund Earners,By Matthew S Levine,wealth,https://www.bloomberg.com/news/articles/2021-02-10/chase-coleman-leads-23-billion-payday-for-15-hedge-fund-earners,GME
307,10-Feb-21,"Zillow’s Rascoff on Retail Investors, Being Short-Seller Target",By Katherine Greifeld,technology,https://www.bloomberg.com/news/videos/2021-02-11/zillow-s-rascoff-on-retail-investors-being-short-seller-target-video,GME
308,13-Feb-21,Your Weekend Reading: Republicans Mull New Party as Trump Case Ends,By Bailey Lipschultz and Paul Jarvis,business,https://www.bloomberg.com/news/newsletters/2021-02-13/your-weekend-reading-republicans-mull-new-party-as-trump-case-ends,GME
310,12-Feb-21,Summers and Krugman Debate Stimulus. Here’s a Blow-by-Blow Account,By Shuli Ren,businessweek,https://www.bloomberg.com/news/articles/2021-02-12/summers-and-krugman-debate-stimulus-here-s-a-blow-by-blow-account,GME
311,8-Feb-21,GameStop (GME) Share Price: Lessons for Playing a Hot Stock Market,By Timothy L O'Brien,wealth,https://www.bloomberg.com/news/articles/2021-02-08/gamestop-gme-share-price-lessons-for-playing-a-hot-stock-market,GME
312,8-Feb-21,GameStop Pauses as Stock’s Selloff Starts to Lose Momentum,"By Ben Holland, Matthew Boesler, and Katia Dmitrieva",business,https://www.bloomberg.com/news/articles/2021-02-08/gamestop-rebounds-from-worst-week-as-wild-ride-starts-to-fizzle,GME
313,8-Feb-21,Elon Musk Works His Magic on Dogecoin and Bitcoin,By Joe Light and Ben Brody,opinion,https://www.bloomberg.com/opinion/articles/2021-02-08/elon-musk-works-his-magic-on-dogecoin-and-bitcoin,GME
314,11-Feb-21,Stock Trading Frenzy Has U.S. Volumes Near Peak Panic Levels,By Justin Fox,markets,https://www.bloomberg.com/news/articles/2021-02-12/stock-trading-frenzy-sends-u-s-volumes-toward-peak-panic-levels,GME
315,12-Feb-21,Disney+ Is Still a Negative in Disney’s Books,By Lionel Laurent,opinion,https://www.bloomberg.com/opinion/articles/2021-02-12/disney-is-still-a-negative-in-disney-s-books,GME
316,12-Feb-21,The King of SPACs Wants You to Know He’s the Next Warren Buffett,By Alex Webb,markets,https://www.bloomberg.com/news/articles/2021-02-12/the-king-of-spacs-wants-you-to-know-he-s-the-next-warren-buffett,GME
317,12-Feb-21,Five Things You Need to Know to Start Your Day,By Matthew S Levine,markets,https://www.bloomberg.com/news/newsletters/2021-02-12/five-things-you-need-to-know-to-start-your-day,GME
318,8-Feb-21,GameStop Fallout: Regulation Need Not Compromise Freedom,By Shuli Ren,opinion,https://www.bloomberg.com/opinion/articles/2021-02-08/gamestop-fallout-regulation-need-not-compromise-freedom,GME
319,12-Feb-21,The Weekly Fix: Skirting Squeezes in CDS; Nerds Take The Stage,By Benjamin Bain,business,https://www.bloomberg.com/news/newsletters/2021-02-12/the-weekly-fix-skirting-squeezes-in-cds-nerds-take-the-stage,GME
320,11-Feb-21,Pot Stocks Flash Back to 2018 Surge as Record Gains Continue,By Lorcan Roche Kelly,markets,https://www.bloomberg.com/news/articles/2021-02-11/pot-stocks-flash-back-to-2018-surge-as-record-gains-continue,GME
321,11-Feb-21,"Bloomberg Australia: Victoria Lockdown, Life Without Google",By Joe Easton,business,https://www.bloomberg.com/news/newsletters/2021-02-12/bloomberg-australia-victoria-lockdown-life-without-google,GME
322,12-Feb-21,Today: Stocks frenzy; Bumble billionaire; Irish border row,By John Authers,markets,https://www.bloomberg.com/news/newsletters/2021-02-12/today-stocks-frenzy-bumble-billionaire-irish-border-row,GME
323,12-Feb-21,Our Best Reads of the Week,By Charlie Wells,business,https://www.bloomberg.com/news/newsletters/2021-02-12/our-best-reads-of-the-week,GME
324,11-Feb-21,Weekly Watchlist: House Democrats Make a Case for Conviction,By Daniel Flatley,business,https://www.bloomberg.com/news/newsletters/2021-02-11/weekly-watchlist-house-democrats-make-a-case-for-conviction,GME
325,11-Feb-21,Turkish Bourse to Fund Small-Cap Research as Retail Traders Grow,By Matthew S Levine,markets,https://www.bloomberg.com/news/articles/2021-02-11/turkish-bourse-to-fund-small-cap-research-as-retail-traders-grow,GME
326,8-Feb-21,Elon Musk Works His Magic on Dogecoin and Bitcoin,By Andreea Papuc and Tracy Alloway,business,https://www.bloomberg.com/news/newsletters/2021-02-08/elon-musk-works-his-magic-on-dogecoin-and-bitcoin-kkwu61uj,GME
327,7-Feb-21,"Niall Ferguson: GameStop, Robinhood, Reddit and the Wind Trade",By Benjamin Bain,opinion,https://www.bloomberg.com/opinion/articles/2021-02-07/niall-ferguson-gamestop-robinhood-reddit-and-the-wind-trade,GME
328,11-Feb-21,WallStreetBets' Reddit Traders Make Short Selling Even More Dangerous,By Pat Regnier,opinion,https://www.bloomberg.com/opinion/articles/2021-02-11/wallstreetbets-reddit-traders-make-short-selling-even-more-dangerous,GME
329,10-Feb-21,PTT Oil Surges in Bangkok Debut After $1.57 Billion IPO,By Bailey Lipschultz,markets,https://www.bloomberg.com/news/articles/2021-02-11/ptt-oil-surges-in-bangkok-debut-after-1-57-billion-ipo,GME
330,11-Feb-21,Facebook Eyes Clubhouse With Familiar Playbook in Mind,By Paul Jarvis,business,https://www.bloomberg.com/news/newsletters/2021-02-11/facebook-eyes-clubhouse-with-familiar-playbook-in-mind,GME
331,10-Feb-21,Reddit's WallStreetBets Meme Stock Surge Reminds Me of 1999,By Priya Anand,opinion,https://www.bloomberg.com/opinion/articles/2021-02-10/reddit-s-wallstreetbets-meme-stock-surge-reminds-me-of-1999,GME
332,11-Feb-21,Bumble (BMBL) Stock Price: Should You Buy Shares After Dating App's IPO?,By Brandon Kochkodin,wealth,https://www.bloomberg.com/news/articles/2021-02-11/bumble-bmbl-stock-price-should-you-buy-shares-after-dating-app-s-ipo,GME
333,11-Feb-21,"Even with the Lunar New Year Break, Chinese Money Keeps Faith in Tencent",By Michael Tobin,opinion,https://www.bloomberg.com/opinion/articles/2021-02-11/even-with-the-lunar-new-year-break-chinese-money-keeps-faith-in-tencent,GME
334,11-Feb-21,"Stimulus Checks: Americans Plan to Save, Not Spend, Covid Relief Money",By Mark Chediak and Catherine Traywick,wealth,https://www.bloomberg.com/news/articles/2021-02-11/stimulus-checks-americans-plan-to-save-not-spend-covid-relief-money,GME
335,6-Feb-21,What May Come Out of GameStop's Wild Ride (Podcast),By Kyle Stock,business,https://www.bloomberg.com/news/audio/2021-02-06/what-may-come-out-of-gamestop-s-wild-ride-podcast,GME
336,10-Feb-21,CPI Inflation Data Clear the Way for Stimulus But Amplify Risks,By Sarah Ponczek,opinion,https://www.bloomberg.com/opinion/articles/2021-02-10/cpi-inflation-data-clear-the-way-for-stimulus-but-amplify-risks,GME
337,10-Feb-21,Your Evening Briefing: Fears of a Return to Inflation Grow in U.S.,By Matthew S Levine,business,https://www.bloomberg.com/news/newsletters/2021-02-10/your-evening-briefing-fears-of-a-return-to-inflation-grow-in-u-s,GME
338,9-Feb-21,Robinhood CEO Defends High-Frequency Trading in Latest Blog Post,By Matthew S Levine,markets,https://www.bloomberg.com/news/articles/2021-02-09/robinhood-ceo-defends-high-frequency-trading-in-latest-post-blog,GME
340,10-Feb-21,"Elon Musk Tweets: Great News For Bitcoin, Bad News for Econ Majors",By Brooke Sample,opinion,https://www.bloomberg.com/opinion/articles/2021-02-10/elon-musk-tweets-great-news-for-bitcoin-bad-news-for-econ-majors,GME
341,6-Feb-21,Weekend Reading Newsletter: GameStop Fallout Finger-Pointing Begins,By Katherine Burton and Hema Parmar,business,https://www.bloomberg.com/news/newsletters/2021-02-06/weekend-reading-newsletter-gamestop-fallout-finger-pointing-begins,GME
342,5-Feb-21,Robinhood GameStop Saga Pressures Payment for Order Flow,By Matthew S Levine,opinion,https://www.bloomberg.com/opinion/articles/2021-02-05/robinhood-gamestop-saga-pressures-payment-for-order-flow,GME
343,9-Feb-21,The SEC Wants Reddit Meme Stocks to Admit They're Dangerous,By Jared Dillian,opinion,https://www.bloomberg.com/opinion/articles/2021-02-09/the-sec-wants-reddit-meme-stocks-to-admit-they-re-dangerous,GME
344,9-Feb-21,The SEC Wants Reddit Meme Stocks to Admit They're Dangerous,By Sarah McBride and Emily Chang,business,https://www.bloomberg.com/news/newsletters/2021-02-09/the-sec-wants-reddit-meme-stocks-to-admit-they-re-dangerous-kky96vuo,GME
345,5-Feb-21,Robinhood GameStop Saga Pressures Payment for Order Flow,By Jarrell Dillard,business,https://www.bloomberg.com/news/newsletters/2021-02-05/robinhood-gamestop-saga-pressures-payment-for-order-flow-kksjpbpt,GME
346,10-Feb-21,"Elon Musk Tweets: Great News For Bitcoin, Bad News for Econ Majors",By Alyza Sebenius,business,https://www.bloomberg.com/news/newsletters/2021-02-10/elon-musk-tweets-great-news-for-bitcoin-bad-news-for-econ-majors-kkzp2132,GME
347,10-Feb-21,"Clubhouse Tops Japan Chart as CEOs, Celebrities Embrace Chat App",By Ian C Sayson,technology,https://www.bloomberg.com/news/articles/2021-02-10/clubhouse-tops-japan-chart-as-ceos-celebrities-embrace-chat-app,GME
348,8-Feb-21,Bloomberg Opinion Radio: Weekend Edition for 2-5-21 (Podcast),By Paul Jarvis and Bailey Lipschultz,business,https://www.bloomberg.com/news/audio/2021-02-08/bloomberg-opinion-radio-weekend-edition-for-2-5-21-podcast,GME
349,5-Feb-21,"Dead Right About GameStop, Four Pros Recount a Week of Reckoning",By Peter Coy,markets,https://www.bloomberg.com/news/articles/2021-02-05/dead-right-about-gamestop-four-pros-recount-a-week-of-reckoning,GME
350,8-Feb-21,Reddit Value Hits $6 Billion After Users Fueled a Stock Frenzy,By Peter Coy,technology,https://www.bloomberg.com/news/articles/2021-02-09/reddit-raises-250-million-after-users-fueled-stock-market-craze,GME
351,5-Feb-21,Dad Uses ‘Trading Places’ to Teach His Son a GameStop Lesson,"By Annie Massa, Yalman Onaran, and Matthew Leising",markets,https://www.bloomberg.com/news/articles/2021-02-05/dad-uses-trading-places-to-teach-his-son-a-gamestop-lesson,GME
352,5-Feb-21,Biotech Surpasses Gamestop as Year’s Best-Performing Retail Pick,By Katherine Burton and Katherine Doherty,markets,https://www.bloomberg.com/news/articles/2021-02-05/biotech-surpasses-gamestop-as-year-s-best-performing-retail-pick,GME
353,9-Feb-21,Fed’s Kaplan Expects Temporary Inflation Spikes During Recovery,By Joe Weisenthal and Tracy Alloway,markets,https://www.bloomberg.com/news/articles/2021-02-09/fed-s-kaplan-expects-temporary-inflation-spikes-during-recovery,GME
