Unnamed: 0,Date,Headline,Author,Eyebrow,Link,Stock
470,31-Jan-21,The Citadel Link: What Ken Griffin Has to Do With GameStop,By Eddie Spence and Ranjeetha Pakiam,wealth,https://www.bloomberg.com/news/articles/2021-01-31/the-citadel-link-what-ken-griffin-has-to-do-with-gamestop,GME
471,2-Feb-21,"VIX, Skew, ETF Shorts Show Stock Market Still Pretty Far From OK",By Lorcan Roche Kelly,markets,https://www.bloomberg.com/news/articles/2021-02-02/vix-skew-etf-shorts-show-stock-market-still-pretty-far-from-ok,GME
472,4-Feb-21,Reddit Revolution Made Saint Petersburg Bourse Russia’s Busiest,By Blaise Robinson,markets,https://www.bloomberg.com/news/articles/2021-02-04/reddit-revolution-made-saint-petersburg-bourse-russia-s-busiest,GME
473,3-Feb-21,"Help, My ETF Got Hijacked by an Internet Flash Mob (Podcast)",By Alan Mirabella,business,https://www.bloomberg.com/news/audio/2021-02-04/help-my-etf-got-hijacked-by-an-internet-flash-mob-podcast,GME
474,4-Feb-21,"Help, My ETF Got Hijacked by an Internet Flash Mob",By Blaise Robinson,business,https://www.bloomberg.com/news/articles/2021-02-04/help-my-etf-got-hijacked-by-an-internet-flash-mob,GME
475,4-Feb-21,Reddit’s Power to Push Stocks Down Is the Next Worry for Traders,"By Katherine Burton, Hema Parmar, and Melissa Karsh",markets,https://www.bloomberg.com/news/articles/2021-02-04/reddit-s-power-to-push-stocks-down-is-the-next-worry-for-traders,GME
476,3-Feb-21,The Silver Squeeze and the Coming Commodities Boom (Podcast),By Mark Gongloff,business,https://www.bloomberg.com/news/audio/2021-02-04/the-silver-squeeze-and-the-coming-commodities-boom-podcast,GME
477,31-Jan-21,"Melvin Lost 53% in January, Hurt by GameStop, Other Bets",By Michael P Regan and Alyza Sebenius,markets,https://www.bloomberg.com/news/articles/2021-01-31/melvin-lost-53-in-january-hurt-by-gamestop-other-bets-dj,GME
478,5-Feb-21,Our Best Reads of the Week,By Yakob Peterseil,business,https://www.bloomberg.com/news/newsletters/2021-02-05/our-best-reads-of-the-week,GME
479,3-Feb-21,Benn Eifert Explains How Retail Trading Is Rocking Markets like Never Before,By Joe Nocera,markets,https://www.bloomberg.com/news/articles/2021-02-03/benn-eifert-explains-how-retail-trading-is-rocking-markets-like-never-before,GME
480,4-Feb-21,Bloomberg Australia: Put Away the Suitcase,By Sarah Ponczek and Michael P Regan,business,https://www.bloomberg.com/news/newsletters/2021-02-05/bloomberg-australia-put-away-the-suitcase,GME
481,5-Feb-21,"UK Rates, German Lockdown, France Recession Risk: Eco Day",By Yvonne Yue Li,markets,https://www.bloomberg.com/news/articles/2021-02-05/uk-rates-german-lockdown-france-recession-risk-eco-day,GME
482,1-Feb-21,We Won't See a GameStop-Like Retail Frenzy in the Silver Market,By Matthew S Levine,opinion,https://www.bloomberg.com/opinion/articles/2021-02-01/silver-won-t-fall-so-easily-to-the-memelords-assault,GME
483,1-Feb-21,Robinhood’s Forbidden-Stocks List Saw Price Swings Narrow Monday,By Nir Kaissar,markets,https://www.bloomberg.com/news/articles/2021-02-01/robinhood-s-forbidden-stocks-list-saw-price-swings-narrow-monday,GME
484,2-Feb-21,"Wall Street Mania Poised to Spur SEC Focus on Apps, Shorts, T+2",By David Rovella,markets,https://www.bloomberg.com/news/articles/2021-02-02/wall-street-mania-poised-to-spur-sec-focus-on-apps-shorts-t-2,GME
485,4-Feb-21,Asia Stocks Climb After U.S. Record; Bonds Steady: Markets Wrap,By Ksenia Galouchko,markets,https://www.bloomberg.com/news/articles/2021-02-04/asia-to-rally-after-u-s-hits-record-dollar-rises-markets-wrap,GME
486,2-Feb-21,How Reddit Traders Are Using an ETF to Bet on Silver: QuickTake,"By Annie Massa, Viren Vaghela, and Yalman Onaran",markets,https://www.bloomberg.com/news/articles/2021-02-02/how-reddit-traders-are-using-an-etf-to-bet-on-silver-quicktake,GME
487,4-Feb-21,Super Bowl LV Bets: Online Gambling Expected to Increase 63% This Year,By Adrian Kennedy,wealth,https://www.bloomberg.com/news/articles/2021-02-04/super-bowl-lv-bets-online-gambling-expected-to-increase-63-this-year,GME
488,3-Feb-21,Baystate Business: Businesses Providing Vaccinations (Radio),By Jake Lloyd-Smith and Ranjeetha Pakiam,business,https://www.bloomberg.com/news/audio/2021-02-03/baystate-business-businesses-providing-vaccinations-radio,GME
489,1-Feb-21,Reddit Crowd Bids Up Silver; Other Commodities Tougher,By Emily Cadman and Donald Moore,markets,https://www.bloomberg.com/news/articles/2021-01-29/reddit-mob-bids-up-silver-other-commodities-are-harder-to-crack,GME
490,2-Feb-21,How Retail Traders Rocked Markets like Never Before (Podcast),By Jake Lloyd-Smith and Ranjeetha Pakiam,business,https://www.bloomberg.com/news/audio/2021-02-02/how-retail-traders-rocked-markets-like-never-before-podcast,GME
491,4-Feb-21,"Trauma Over, Hedge Funds Race Their Bull Market Engines Again",By Joe Deaux,markets,https://www.bloomberg.com/news/articles/2021-02-04/trauma-over-hedge-funds-race-their-bull-market-engines-again,GME
492,1-Feb-21,What Comes Next in Robinhood’s Post-GameStop Future?,By Will Wade,markets,https://www.bloomberg.com/news/videos/2021-02-01/what-comes-next-in-robinhood-s-post-gamestop-future-video,GME
493,2-Feb-21,Robinhood Lawsuits Face Uphill Battle (Podcast),By Justina Lee,business,https://www.bloomberg.com/news/audio/2021-02-03/robinhood-lawsuits-face-uphill-battle-podcast,GME
494,4-Feb-21,"In Defense of Shorts, Hindenburg Takes on Palihapitiya’s Clover",By Joanna Ossinger,markets,https://www.bloomberg.com/news/articles/2021-02-04/in-defense-of-shorts-hindenburg-takes-on-palihapitiya-s-clover,GME
495,4-Feb-21,"Robinhood App Downloads Top 600,000 as Angry Traders Find It Hard to Switch",By Mark Gongloff,wealth,https://www.bloomberg.com/news/articles/2021-02-04/robinhood-downloads-surge-as-it-plans-super-bowl-ad-after-gamestop-gme-revolt,GME
496,4-Feb-21,Yellen’s Step Into Market Mania Tests Consumer-Protection Stance,By The Editors,wealth,https://www.bloomberg.com/news/articles/2021-02-04/yellen-s-step-into-market-mania-tests-consumer-protection-stance,GME
497,31-Jan-21,Biden Aides Say Market Oversight of GameStop Frenzy Is Working,By Lorcan Roche Kelly and Tracy Alloway,business,https://www.bloomberg.com/news/articles/2021-01-31/biden-aides-say-market-oversight-of-gamestop-frenzy-is-working,GME
498,1-Feb-21,"Cantor’s Lutnick Says Market Took a Breath, Is Now ‘Good to Go’",By Abhishek Vishnoi,markets,https://www.bloomberg.com/news/articles/2021-02-01/cantor-s-lutnick-says-market-took-a-breath-is-now-good-to-go,GME
499,31-Jan-21,"Matt Levine, John Authers: Is GameStop (GME) the Only Game in Town?",By Eric Lam,opinion,https://www.bloomberg.com/opinion/articles/2021-01-31/matt-levine-john-authers-is-gamestop-gme-the-only-game-in-town-kkl5j5um,GME
500,1-Feb-21,Carson Block Suspects Hedge Fund Coordination in Short Squeezes,By Annie Massa,markets,https://www.bloomberg.com/news/articles/2021-02-01/carson-block-suspects-hedge-fund-coordination-in-short-squeezes,GME
501,1-Feb-21,"Balance of Power: Stimulus, Gamestop Saga, 5G , China (Podcast)","By Gillian Tan, Lizette Chapman, and Annie Massa",business,https://www.bloomberg.com/news/audio/2021-02-01/balance-of-power-stimulus-gamestop-saga-5g-china-podcast,GME
502,4-Feb-21,Robinhood Tallies an Options Bonanza While Newcomers Wreak Havoc,By Annie Massa,wealth,https://www.bloomberg.com/news/articles/2021-02-04/robinhood-tallies-an-options-bonanza-while-newcomers-wreak-havoc,GME
503,4-Feb-21,Caution Redditors: Overtrading Can Hurt Returns (and Your Retirement),By Tracy Alloway and Joe Weisenthal,opinion,https://www.bloomberg.com/opinion/articles/2021-02-04/caution-redditors-overtrading-can-hurt-returns-and-your-retirement,GME
504,4-Feb-21,"EU Vaccine Hit, BOE Decision, Yellen Meets Regulators: Eco Day",By Anna Kitanaka,markets,https://www.bloomberg.com/news/articles/2021-02-04/eu-vaccine-hit-boe-decision-yellen-meets-regulators-eco-day,GME
505,1-Feb-21,Carson Block Says Financial Markets Are Broken,By Charlie Zhu and Evelyn Yu,markets,https://www.bloomberg.com/news/videos/2021-02-01/carson-block-says-financial-markets-are-broken-video,GME
506,31-Jan-21,GameStop Puzzle: A Game That You Can’t Stop,"By Jordan Fabian, Erik Wasson, and Jarrell Dillard",opinion,https://www.bloomberg.com/opinion/articles/2021-01-31/gamestop-puzzle-a-game-that-you-can-t-stop,GME
507,31-Jan-21,GameStop Short Nightmare Shows Few Signs of Becoming a Contagion,By Lionel Laurent,markets,https://www.bloomberg.com/news/articles/2021-01-31/gamestop-short-nightmare-shows-few-signs-of-becoming-a-contagion,GME
508,3-Feb-21,"Asia Funds Skirt Reddit Rout as LyGH, Pinpoint Post Gains",By John Authers,markets,https://www.bloomberg.com/news/articles/2021-02-04/asia-hedge-funds-skirt-reddit-rout-as-lygh-pinpoint-post-gains,GME
509,3-Feb-21,Cathie Wood’s Nod Boosts DraftKings in New Sign of Her Power,By Chris Dolmetsch,markets,https://www.bloomberg.com/news/articles/2021-02-03/cathie-wood-s-nod-boosts-draftkings-in-new-sign-of-her-power,GME
510,4-Feb-21,"Korea, Country With Longest Short-Selling Ban, Risks Market Fall",By Marcus Ashworth,markets,https://www.bloomberg.com/news/articles/2021-02-04/korea-country-with-longest-short-selling-ban-risks-market-fall,GME
511,2-Feb-21,Cohen’s Point72 Raises $1.5 Billion After Melvin Infusion,By Matthew S Levine,markets,https://www.bloomberg.com/news/articles/2021-02-02/cohen-s-point72-raises-1-5-billion-after-melvin-infusion,GME
512,30-Jan-21,"Nokia Stock Is Serious, GameStop Stock Is a Game",By Steven T. Dennis and Laura Davison,opinion,https://www.bloomberg.com/opinion/articles/2021-01-30/nokia-stock-is-serious-gamestop-stock-is-a-game-kkjq3ce7,GME
513,3-Feb-21,"U.S. Pickup, Japan-China Decouple, Biden Firm on $1,400: Eco Day",By Steven Crabill,markets,https://www.bloomberg.com/news/articles/2021-02-03/u-s-pickup-japan-china-decouple-biden-firm-on-1-400-eco-day,GME
514,1-Feb-21,Retail Frenzy Winners and Losers,By Mark Gongloff,business,https://www.bloomberg.com/news/videos/2021-02-01/retail-frenzy-winners-and-losers-video,GME
515,3-Feb-21,Goldman Sachs’s Rahmani Strikes Warning Over Bitcoin Value,By Annie Massa and Misyrlena Egkolfopoulou,technology,https://www.bloomberg.com/news/articles/2021-02-03/goldman-sachs-s-rahmani-strikes-warning-over-bitcoin-value,GME
516,4-Feb-21,Inflation Will Force the Federal Reserve to Rethink Monetary Policy,By Joanna Ossinger,opinion,https://www.bloomberg.com/opinion/articles/2021-02-04/inflation-will-force-the-federal-reserve-to-rethink-monetary-policy,GME
517,3-Feb-21,"U.S. Boost, Yellen Watches Volatility, Innovation Index: Eco Day",By Bailey Lipschultz,markets,https://www.bloomberg.com/news/articles/2021-02-03/u-s-boost-yellen-watches-volatility-innovation-index-eco-day,GME
518,3-Feb-21,Five Things You Need to Know to Start Your Day,By Shuli Ren,markets,https://www.bloomberg.com/news/newsletters/2021-02-03/five-things-you-need-to-know-to-start-your-day,GME
520,4-Feb-21,Five Things You Need to Know to Start Your Day,By Paul Jarvis,markets,https://www.bloomberg.com/news/newsletters/2021-02-04/five-things-you-need-to-know-to-start-your-day,GME
521,4-Feb-21,Markets Give Biden Another Thing to Fret About,By Olga Kharif,politics,https://www.bloomberg.com/news/newsletters/2021-02-04/markets-give-biden-another-thing-to-fret-about,GME
522,1-Feb-21,David Versus Goliath Is A Myth: Macro Man Podcast,By Katherine Greifeld,business,https://www.bloomberg.com/news/audio/2021-02-01/david-versus-goliath-is-a-myth-macro-man-podcast,GME
523,2-Feb-21,Silver Finds Calmer Tone After Posting Biggest Drop Since August,By Sam Unsted,markets,https://www.bloomberg.com/news/articles/2021-02-02/silver-finds-calmer-tone-after-posting-biggest-drop-since-august,GME
524,29-Jan-21,GameStop Frenzy Shows Frustration With System: Atwater,By Hema Parmar and Nishant Kumar,business,https://www.bloomberg.com/news/videos/2021-01-30/gamestop-frenzy-shows-frustration-with-system-atwater-video,GME
525,3-Feb-21,U.S. Equity Futures Rise; Crude Oil Extends Gain: Markets Wrap,By Andreea Papuc,markets,https://www.bloomberg.com/news/articles/2021-02-03/asia-stocks-to-slip-after-s-p-500-pares-advance-markets-wrap,GME
526,2-Feb-21,Washington Nibbles at Edges of Stock Frenzy That Defies Fast Fix,By Annie Massa,politics,https://www.bloomberg.com/news/articles/2021-02-02/washington-nibbles-at-edges-of-stock-frenzy-that-defies-fast-fix,GME
527,30-Jan-21,GameStop (GME) Short Squeeze: Who Will Surrender First?,By Yueqi Yang,opinion,https://www.bloomberg.com/opinion/articles/2021-01-30/gamestop-gme-short-squeeze-who-will-surrender-first,GME
528,2-Feb-21,Mark Cuban Thanks WallStreetBets for ‘Taking On Wall Street’,By David Rovella,wealth,https://www.bloomberg.com/news/articles/2021-02-02/mark-cuban-thanks-wallstreetbets-for-taking-on-wall-street,GME
529,3-Feb-21,Robinhood Crisis Reveals Hidden Costs in Zero-Fee Trading Model,By Justina Lee,wealth,https://www.bloomberg.com/news/articles/2021-02-03/robinhood-crisis-reveals-hidden-costs-in-zero-fee-trading-model,GME
530,1-Feb-21,Oreana's Poole Says There May Be 'Structural Shift' in U.S. Equity Market,"By Jack Farchy, Eddie Spence, and Eddie van der Walt",business,https://www.bloomberg.com/news/videos/2021-02-01/oreana-s-poole-says-there-may-be-structural-shift-in-u-s-equity-market-video,GME
531,4-Feb-21,Distressed-Debt Hedge Funds Have Nowhere to Go,By Paul Jarvis,opinion,https://www.bloomberg.com/opinion/articles/2021-02-04/distressed-debt-hedge-funds-have-nowhere-to-go,GME
532,3-Feb-21,"Tom Hayes Says Libor Should Stay, Convicts Are Crazy for Crypto","By Jackie Edwards, Ronojoy Mazumdar, and Ishika Mookerjee",markets,https://www.bloomberg.com/news/articles/2021-02-03/tom-hayes-sees-no-need-to-end-libor-rate-that-sent-him-to-jail,GME
533,3-Feb-21,Five Things You Need to Know to Start Your Day,By Matthew S Levine,business,https://www.bloomberg.com/news/newsletters/2021-02-03/five-things-you-need-to-know-to-start-your-day-kkq25r1k,GME
534,2-Feb-21,"Bezos steps down, Reddit rally reverses: 5 things to start your day",By Andreea Papuc,business,https://www.bloomberg.com/news/newsletters/2021-02-02/bezos-steps-down-reddit-rally-fizzles-5-things-to-start-your-day,GME
535,29-Jan-21,GameStop Rally Wreaks Havoc on Wall Street,By Conor Sen,markets,https://www.bloomberg.com/news/videos/2021-01-29/gamestop-rally-wreaks-havoc-on-wall-street-video,GME
536,30-Jan-21,How One True GameStop Believer Scored Big After Years of Work,By Chris Dolmetsch and Christopher Yasiejko,markets,https://www.bloomberg.com/news/articles/2021-01-30/how-one-true-gamestop-believer-scored-big-after-years-of-work,GME
537,29-Jan-21,Coatue Hedge Fund Skirts GameStop Losses While Rivals Bleed,By Reed Stevenson,markets,https://www.bloomberg.com/news/articles/2021-01-29/coatue-hedge-fund-skirts-gamestop-losses-while-rivals-bleed,GME
538,30-Jan-21,GameStop Mania Is Delivering a Dangerous Rush to the Reddit Mob,By Heejin Kim,markets,https://www.bloomberg.com/news/articles/2021-01-30/-like-a-drug-redditors-stock-mania-fueled-by-gambling-high,GME
539,3-Feb-21,"U.S. Economy Is Improving, Complicating Biden’s Stimulus Plans",By Lorcan Roche Kelly,politics,https://www.bloomberg.com/news/articles/2021-02-03/u-s-economy-is-improving-complicating-biden-s-stimulus-plans,GME
540,29-Jan-21,Historic Week for GameStop Ends With 400% Rally as Shorts Yield,"By Ronojoy Mazumdar, Ishika Mookerjee, and Moxy Ying",markets,https://www.bloomberg.com/news/articles/2021-01-29/historic-week-for-gamestop-ends-with-400-rally-as-shorts-yield,GME
541,2-Feb-21,Equities Extend Rally in Asia; Dollar Holds Losses: Markets Wrap,By Patrick Clark and Natalie Wong,markets,https://www.bloomberg.com/news/articles/2021-02-02/equity-rally-to-extend-in-asia-dollar-slips-markets-wrap,GME
542,29-Jan-21,How a First-Time Trader Hit It Big With GameStop,By Claire Ballentine,markets,https://www.bloomberg.com/news/videos/2021-01-29/how-a-first-time-trader-hit-it-big-with-gamestop-video,GME
543,3-Feb-21,Your Evening Briefing: U.S. Falls in Innovation Ranking,By Cormac Mullen,business,https://www.bloomberg.com/news/newsletters/2021-02-03/your-evening-briefing-u-s-falls-in-innovation-ranking,GME
544,29-Jan-21,Finding Value in GameStop Before All the Retail Mania: Rod Alzmann,By Hannah Levitt,business,https://www.bloomberg.com/news/videos/2021-01-29/finding-value-in-gamestop-before-all-the-retail-mania-rod-alzmann-video,GME
545,2-Feb-21,"Trump’s Immigration Legacy: Family Separations, Border Wall",By Charlie Wells and Misyrlena Egkolfopoulou,opinion,https://www.bloomberg.com/opinion/articles/2021-02-02/trump-s-immigration-legacy-family-separations-border-wall,GME
546,29-Jan-21,What GameStop Customers Think About Stock Market Drama,By Michael Heath,markets,https://www.bloomberg.com/news/videos/2021-01-29/what-gamestop-customers-think-about-stock-market-drama-video,GME
547,1-Feb-21,"Acting SEC Chief Says Market Strong, Fraud Probes a Top Priority",By Brian Chappatta,politics,https://www.bloomberg.com/news/articles/2021-02-02/acting-sec-chief-says-market-strong-fraud-probes-a-top-priority,GME
548,3-Feb-21,Jeff Bezos Resigns as Amazon CEO. Here’s What Comes Next,By Charlie Wells,business,https://www.bloomberg.com/news/newsletters/2021-02-03/jeff-bezos-resigns-as-amazon-ceo-here-s-what-comes-next,GME
549,3-Feb-21,WHO Director General on Preparing For Post-Covid Pandemics,By Matthew Boesler,opinion,https://www.bloomberg.com/opinion/articles/2021-02-03/who-director-general-on-preparing-for-post-covid-pandemics,GME
550,29-Jan-21,GameStop’s Surge Puts Hedge Fund Risk in Focus,By Katherine Greifeld,markets,https://www.bloomberg.com/news/videos/2021-01-29/gamestop-s-surge-puts-hedge-fund-risk-in-focus-video,GME
551,2-Feb-21,Founders of China’s Robinhood Apps Make Billions on Retail Mania,By Jordan Fabian and Jennifer Epstein,wealth,https://www.bloomberg.com/news/articles/2021-02-02/founders-of-china-s-robinhood-apps-make-billions-on-retail-mania,GME
552,29-Jan-21,Roaring Kitty Who Inspired  GameStop Surge Has Tips to Find Next Moonshot Stock,By Lionel Laurent,wealth,https://www.bloomberg.com/news/articles/2021-01-29/roaring-kitty-who-inspired-gamestop-surge-has-tips-to-find-next-moonshot-stock,GME
553,29-Jan-21,"Warren Asks SEC to Address Market Manipulation, GameStop",By Alex Webb,politics,https://www.bloomberg.com/news/articles/2021-01-29/warren-demands-sec-address-market-manipulation-gamestop-surge,GME
554,29-Jan-21,M1 Finance CEO on Limiting Trading in Wake of GameStop Frenzy,By John Authers,technology,https://www.bloomberg.com/news/videos/2021-01-29/m1-finance-ceo-on-limiting-trading-in-wake-of-gamestop-frenzy-video,GME
555,29-Jan-21,GameStop Stays Silent in the Face of Reddit-Fueled Maelstrom,By Jake Lloyd-Smith,markets,https://www.bloomberg.com/news/articles/2021-01-29/gamestop-stays-silent-in-the-face-of-reddit-fueled-maelstrom,GME
556,29-Jan-21,GameStop Executives Sitting on $1.3 Billion Gain From Frenzy,By Brooke Sutherland,wealth,https://www.bloomberg.com/news/articles/2021-01-29/gamestop-executives-sit-on-1-3-billion-gain-from-trading-frenzy,GME
557,29-Jan-21,Reddit Traders on Robinhood Are on Both Sides of GameStop,By Rick Clough,business,https://www.bloomberg.com/news/newsletters/2021-01-29/reddit-traders-on-robinhood-are-on-both-sides-of-gamestop-kkijh28u,GME
558,2-Feb-21,European Equities Recover From Volatile Week on Vaccine Optimism,By Olga Kharif,markets,https://www.bloomberg.com/news/articles/2021-02-02/european-stocks-rally-as-worries-about-retail-speculation-ease,GME
559,29-Jan-21,GameStop Drama Hammers Retail ETF as Nearly 80% of Assets Exit,By Nishant Kumar,markets,https://www.bloomberg.com/news/articles/2021-01-29/the-gamestop-drama-just-cost-one-etf-almost-80-of-its-assets,GME
560,2-Feb-21,Mark Cuban Tells WallStreetBets to Hold ‘If You Can Afford to’,By Lorcan Roche Kelly,wealth,https://www.bloomberg.com/news/articles/2021-02-02/mark-cuban-tells-wallstreetbets-to-hold-if-you-can-afford-to,GME
561,29-Jan-21,Ark Mania Finally Fading After GameStop Fever Sweeps Wall Street,By Heejin Kim,markets,https://www.bloomberg.com/news/articles/2021-01-29/ark-mania-finally-fading-after-gamestop-fever-sweeps-wall-street,GME
562,29-Jan-21,GameStop Trading and Robinhood’s Fallout (Podcast),By Sybilla Gross and Tracy Alloway,business,https://www.bloomberg.com/news/audio/2021-01-30/gamestop-trading-and-robinhood-s-fallout-podcast,GME
563,2-Feb-21,Goldman Still Prefers Silver Even If Short Squeeze Unattainable,By Sam Unsted,markets,https://www.bloomberg.com/news/articles/2021-02-02/goldman-still-prefers-silver-even-if-short-squeeze-unattainable,GME
564,3-Feb-21,"Stock Markets Today: Reddit Investors, Mario Draghi, Jeff Bezos, Vaccines",By Margaret Sutherlin,markets,https://www.bloomberg.com/news/newsletters/2021-02-03/stock-markets-today-reddit-investors-mario-draghi-jeff-bezos-vaccines,GME
565,2-Feb-21,Robinhood Says Stock Settlement Times Are a Wall Street Risk,By Brian Chappatta,markets,https://www.bloomberg.com/news/articles/2021-02-02/robinhood-saga-renews-wall-street-group-s-move-to-limit-risks,GME
566,3-Feb-21,Covid Vaccine Help Comes With Strings Attached,By Yueqi Yang,politics,https://www.bloomberg.com/news/newsletters/2021-02-03/vaccine-help-comes-with-strings-attached,GME
567,2-Feb-21,Silver Sinks as Investor Frenzy Cools After Reddit Backlash,By Michael P Regan and Vildana Hajric,markets,https://www.bloomberg.com/news/articles/2021-02-02/silver-sinks-as-investor-frenzy-cools-and-reddit-backlash-grows,GME
568,2-Feb-21,Five Things You Need to Know to Start Your Day,By Paul Jarvis,markets,https://www.bloomberg.com/news/newsletters/2021-02-02/five-things-you-need-to-know-to-start-your-day,GME
569,1-Feb-21,Surveillance: Reddit Frenzy Spreads (Podcast),By Ishika Mookerjee,business,https://www.bloomberg.com/news/audio/2021-02-01/surveillance-reddit-frenzy-spreads-podcast-kkmuyua7,GME
570,29-Jan-21,GameStop Surges in Premarket as Some Trading Restrictions Lifted,By Michael P Regan and Vildana Hajric,technology,https://www.bloomberg.com/news/articles/2021-01-29/gamestop-surges-in-premarket-as-some-trading-restrictions-lifted-kki5vxkd,GME
571,29-Jan-21,Dalio Says GameStop Drama Reflects Growing Intolerance in U.S.,By Edward Johnson,markets,https://www.bloomberg.com/news/articles/2021-01-29/dalio-says-gamestop-drama-reflects-growing-intolerance-in-u-s,GME
572,29-Jan-21,GameStop Surges in Premarket as Some Trading Restrictions Lifted,By Katherine Greifeld and Sarah Ponczek,markets,https://www.bloomberg.com/news/articles/2021-01-29/gamestop-surges-in-premarket-as-some-trading-restrictions-lifted,GME
573,1-Feb-21,"Bloomberg Daybreak: February 1, 2021 - Hour 2 (Radio)",By Gearoid Reidy,business,https://www.bloomberg.com/news/audio/2021-02-01/bloomberg-daybreak-february-1-2021-hour-2-radio,GME
574,2-Feb-21,"Mudrick Wins, Eminence Drops as Reddit Rout Hits Hedge Funds",By Katia Porzecanski,markets,https://www.bloomberg.com/news/articles/2021-02-02/mudrick-gains-lone-pine-drops-as-hedge-funds-endure-reddit-rout,GME
575,29-Jan-21,Redditors Buying GameStop Won’t Break Finance,By Adam Haigh,opinion,https://www.bloomberg.com/opinion/articles/2021-01-29/redditors-buying-gamestop-won-t-break-finance,GME
576,2-Feb-21,Reddit’s Market ‘Hype Machine’ Is in a Quest to Drive Out Bots,By Nancy Cook,markets,https://www.bloomberg.com/news/articles/2021-02-02/reddit-s-market-hype-machine-is-in-a-quest-to-drive-out-bots,GME
577,2-Feb-21,A Onetime Giant of Volatility Has Gone Haywire in OTC Trading,By Luke McGrath and Annie Massa,markets,https://www.bloomberg.com/news/articles/2021-02-02/a-one-time-giant-of-volatility-has-gone-haywire-in-otc-trading,GME
578,29-Jan-21,GameStop (GME) Trading: Short Sellers Like Citron Aren’t the Enemy,By Joanna Ossinger,opinion,https://www.bloomberg.com/opinion/articles/2021-01-29/gamestop-gme-trading-short-sellers-like-citron-aren-t-the-enemy,GME
579,29-Jan-21,Moral of GameStop Tale: ‘People Are Allowed to Pay Stupid Prices’,By Annie Massa,markets,https://www.bloomberg.com/news/articles/2021-01-29/moral-of-gamestop-tale-people-are-allowed-to-pay-stupid-prices,GME
580,1-Feb-21,"Bishop’s Impala Fund Gained in January, Dodging Market Selloff",By Mohamed Aly El-Erian,markets,https://www.bloomberg.com/news/articles/2021-02-01/bishop-s-impala-fund-gained-in-january-dodging-market-selloff,GME
581,29-Jan-21,Reddit Traders on Robinhood Are on Both Sides of GameStop,By Brian Chappatta,opinion,https://www.bloomberg.com/opinion/articles/2021-01-29/reddit-traders-on-robinhood-are-on-both-sides-of-gamestop,GME
582,31-Jan-21,"Luciano Jannelli, Head of Investment Strategy at ADCB, on EU Vaccine Plan and China's Recovery",By Annie Massa,business,https://www.bloomberg.com/news/videos/2021-01-31/luciano-jannelli-head-of-investment-strategy-at-adcb-on-eu-vaccine-plan-and-china-s-recovery-video,GME
583,29-Jan-21,GameStop (GME) Short Squeeze Shouldn't Be Used to Derail Investors,By Daniel Flatley and Erik Wasson,opinion,https://www.bloomberg.com/opinion/articles/2021-01-29/gamestop-gme-short-squeeze-shouldn-t-be-used-to-derail-investors,GME
584,2-Feb-21,Your Evening Briefing: Jeff Bezos Is Stepping Down as Amazon CEO,By Olga Kharif,business,https://www.bloomberg.com/news/newsletters/2021-02-02/your-evening-briefing-jeff-bezos-is-stepping-down-as-amazon-ceo,GME
585,2-Feb-21,SocGen Quant Warns as Weak Balance Sheet Stocks Hit Record,By Charlie Wells,markets,https://www.bloomberg.com/news/articles/2021-02-02/weak-balance-sheets-favored-by-day-traders-swamping-russell-2000,GME
586,29-Jan-21,What’s the DTCC and How Did It Stop GameStop Mania?: QuickTake,By Mark Gilbert,markets,https://www.bloomberg.com/news/articles/2021-01-29/what-s-the-dtcc-and-how-did-it-stop-gamestop-mania-quicktake,GME
