Unnamed: 0,Date,Headline,Author,Eyebrow,Link,Stock
354,10-Feb-21,Authers’ Notes-“Great Demographic Reversal”: TOPLive Transcript,By Mark Gongloff,business,https://www.bloomberg.com/news/articles/2021-02-10/authers-notes-great-demographic-reversal-toplive-transcript,GME
355,4-Feb-21,"Robinhood Removes Limits on Buying GameStop, AMC Entertainment","By Bei Hu, William Shaw, and Suzy Waite",markets,https://www.bloomberg.com/news/articles/2021-02-05/robinhood-removes-limits-on-buying-gamestop-amc-entertainment,GME
356,5-Feb-21,Yellen Concern About GameStop (GME) Trading Is Misplaced,By Catherine Bosley,opinion,https://www.bloomberg.com/opinion/articles/2021-02-05/yellen-concern-about-gamestop-gme-trading-is-misplaced,GME
357,9-Feb-21,Trump's Second Impeachment Trial Could Be His Last Hurrah,By Anchalee Worrachate,opinion,https://www.bloomberg.com/opinion/articles/2021-02-09/trump-s-second-impeachment-trial-could-be-his-last-hurrah,GME
358,8-Feb-21,Hedge Funds Rose 0.6% in January Even as Broader Market Fell,By Heejin Kim,markets,https://www.bloomberg.com/news/articles/2021-02-08/hedge-funds-rose-0-6-in-january-led-by-event-driven-funds,GME
359,6-Feb-21,Goldman Commodities Strategist Says Silver Is the Populist Metal,By Jordan Fabian,markets,https://www.bloomberg.com/news/articles/2021-02-06/goldman-commodities-strategist-says-silver-is-the-populist-metal,GME
360,5-Feb-21,To Prevent Future GameStops (GME) Promote Stock Futures,By Michael Msika and Jake Lloyd-Smith,opinion,https://www.bloomberg.com/opinion/articles/2021-02-05/to-prevent-future-gamestops-gme-promote-stock-futures,GME
361,8-Feb-21,Take-Two Slips After Missing Out on Deal to Electronic Arts,By Gearoid Reidy and Shoko Oda,markets,https://www.bloomberg.com/news/articles/2021-02-08/take-two-slips-after-missing-out-on-deal-to-electronic-arts,GME
362,8-Feb-21,Mike Novogratz's Vision for Rebuilding Finance with Crypto,By Matthew S Levine,markets,https://www.bloomberg.com/news/articles/2021-02-08/mike-novogratz-s-vision-for-rebuilding-finance-with-crypto,GME
363,8-Feb-21,Robinhood Sued by Parents of Young Trader Who Killed Himself,By Katherine Greifeld and Lu Wang,business,https://www.bloomberg.com/news/articles/2021-02-09/robinhood-sued-by-parents-of-options-trader-who-killed-himself,GME
364,4-Feb-21,Could Covid Isolation Explain Both Capitol Riots and GameStop?,By Bailey Lipschultz,opinion,https://www.bloomberg.com/opinion/articles/2021-02-04/could-covid-isolation-explain-both-capitol-riots-and-gamestop,GME
365,4-Feb-21,Elon Musk's GameStop Tweets Are Now a Hedge Fund Signal,By Sonali Basak,business,https://www.bloomberg.com/news/newsletters/2021-02-04/elon-musk-s-gamestop-tweets-are-now-a-hedge-fund-signal-kkr4olt7,GME
366,5-Feb-21,"The Weekly Fix: Reddit, Powell, Bonds, Reflation, AMC, GameStop",By Matthew S Levine,business,https://www.bloomberg.com/news/newsletters/2021-02-05/the-weekly-fix-reddit-powell-bonds-reflation-amc-gamestop,GME
367,4-Feb-21,GameStop Shares Fall as Reddit-Fueled Traders Seek Next Thrill,By Chris Bryant,markets,https://www.bloomberg.com/news/articles/2021-02-04/gamestop-rises-in-premarket-as-stock-s-momentum-cools-down,GME
368,7-Feb-21,How to Rebuild Finance with Crypto (Podcast),By Nancy Moran,business,https://www.bloomberg.com/news/audio/2021-02-07/how-to-rebuild-finance-with-crypto-podcast,GME
369,5-Feb-21,"Silver, GameStop (GME), AMC, Amazon (AMZN), Australian Wine: Investments Bets",By Jim Bianco,wealth,https://www.bloomberg.com/news/articles/2021-02-05/silver-gamestop-gme-amc-amazon-amzn-australian-wine-investments-bets,GME
370,5-Feb-21,"Benchmark's Bill Gurley On GameStop Frenzy, Robinhood's Model And Direct Listing",By John Harney,technology,https://www.bloomberg.com/news/videos/2021-02-05/benchmark-s-bill-gurley-on-gamestop-frenzy-robinhood-s-model-and-direct-listing-video,GME
371,4-Feb-21,GameStop Frenzy Is a Reason to Delist Chinese Companies and Alert the SEC,By Michael Winfrey,opinion,https://www.bloomberg.com/opinion/articles/2021-02-04/gamestop-frenzy-is-a-reason-to-delist-chinese-companies-and-alert-the-sec,GME
372,4-Feb-21,GameStop Taught Robinhood CEO Vlad Tenev a Lesson in PR,By Paul Jarvis,opinion,https://www.bloomberg.com/opinion/articles/2021-02-04/gamestop-taught-robinhood-ceo-vlad-tenev-a-lesson-in-pr,GME
373,9-Feb-21,Biden Presidency Starts With a Giant Bet on Run-It-Hot Economics,By Christopher Condon and Saleha Mohsin,markets,https://www.bloomberg.com/news/articles/2021-02-09/biden-presidency-starts-with-a-giant-bet-on-run-it-hot-economics,GME
374,4-Feb-21,GameStop Mania Stirs New Ire for Social-Media Shield Trump Hates,By Elaine Ou,technology,https://www.bloomberg.com/news/articles/2021-02-04/gamestop-mania-stirs-new-ire-for-social-media-shield-trump-hates,GME
375,8-Feb-21,The Elon Musk Cargo Cult Keeps Growing,"By Sarah Ponczek, Katharine Gemmell, and Charlie Wells",opinion,https://www.bloomberg.com/opinion/articles/2021-02-09/the-elon-musk-cargo-cult-keeps-growing,GME
376,8-Feb-21,Why Elon Musk’s Dogecoin Tweets Have Hit a Bitcoin Nerve,By Tasos Vossos and Michael Msika,opinion,https://www.bloomberg.com/opinion/articles/2021-02-08/why-elon-musk-s-dogecoin-tweets-have-hit-a-bitcoin-nerve,GME
377,8-Feb-21,"What Facebook (FB), Twitter (TWTR), Apple (AAPL), Robinhood Have in Common",By Tasos Vossos and Michael Msika,businessweek,https://www.bloomberg.com/news/articles/2021-02-08/what-facebook-fb-twitter-twtr-apple-aapl-robinhood-have-in-common,GME
378,4-Feb-21,Elon Musk's GameStop Tweets Are Now a Hedge Fund Signal,By David Rovella,opinion,https://www.bloomberg.com/opinion/articles/2021-02-04/elon-musk-s-gamestop-tweets-are-now-a-hedge-fund-signal,GME
379,8-Feb-21,Distressed Companies Are Different in the U.S. and China. Just Do the Math.,By Anders Melin and Hema Parmar,opinion,https://www.bloomberg.com/opinion/articles/2021-02-08/distressed-companies-are-different-in-the-u-s-and-china-just-do-the-math,GME
380,3-Feb-21,SEC Hunts for Fraud in Social Media Posts That Hyped GameStop,By Shuli Ren,business,https://www.bloomberg.com/news/videos/2021-02-04/sec-hunts-for-fraud-in-social-media-posts-that-hyped-gamestop-video,GME
381,5-Feb-21,Game-Like Apps Robinhood Popularized Get Added Finra Scrutiny,By Saleha Mohsin and Christopher Condon,markets,https://www.bloomberg.com/news/articles/2021-02-05/game-like-apps-robinhood-popularized-get-added-finra-scrutiny,GME
382,8-Feb-21,Five Things You Need to Know to Start Your Day,By Claire Ballentine,markets,https://www.bloomberg.com/news/newsletters/2021-02-08/five-things-you-need-to-know-to-start-your-day,GME
383,9-Feb-21,Stock Markets Today: Bitcoin's Tesla rally; steady stock markets; Trump trial,By Charlie Wells and Katharine Gemmell,markets,https://www.bloomberg.com/news/newsletters/2021-02-09/stock-markets-today-bitcoin-s-tesla-rally-steady-stock-markets-trump-trial,GME
384,9-Feb-21,Inflation Markets Bet the Fed Really Does Like It Hot,By Matthew Boesler,opinion,https://www.bloomberg.com/opinion/articles/2021-02-09/inflation-markets-bet-the-fed-really-does-like-it-hot,GME
385,4-Feb-21,Bloomberg Wealth: The $159 Billion Lesson of GameStop,By Sybilla Gross and Tracy Alloway,wealth,https://www.bloomberg.com/news/newsletters/2021-02-04/bloomberg-wealth-the-159-billion-lesson-of-gamestop,GME
386,3-Feb-21,"Citadel, Robinhood on Waters’s ‘Wish List’ for GameStop Hearing",By Nir Kaissar,politics,https://www.bloomberg.com/news/articles/2021-02-03/citadel-robinhood-on-waters-s-wish-list-for-gamestop-hearing-kkq1n8ws,GME
387,3-Feb-21,Goldman Sachs Goes to Supreme Court; Hedge Funds Won on GameStop,By Olivia Raimonde,opinion,https://www.bloomberg.com/opinion/articles/2021-02-03/goldman-sachs-goes-to-supreme-court-hedge-funds-won-on-gamestop-kkpoe6ws,GME
388,5-Feb-21,Wall Street Week - Full Show (02/05/2021),By Tracy Alloway and Joe Weisenthal,business,https://www.bloomberg.com/news/videos/2021-02-06/wall-street-week-full-show-02-05-2021-video-kkt5zfc0,GME
389,7-Feb-21,Five Things You Need to Know to Start Your Day,By Kevin Orland,business,https://www.bloomberg.com/news/newsletters/2021-02-07/five-things-you-need-to-know-to-start-your-day,GME
390,3-Feb-21,SEC Hunts for Fraud in Social-Media Posts That Drove Up GameStop,By Sam Unsted,markets,https://www.bloomberg.com/news/articles/2021-02-03/sec-hunts-for-fraud-in-social-media-posts-that-drove-up-gamestop,GME
391,4-Feb-21,GameStop (GME): How WallStreetBets and Robinhood Created Bonkers Stock Market,By Mathieu Benhamou and Jeremy Cf Lin,businessweek,https://www.bloomberg.com/news/features/2021-02-04/gamestop-gme-how-wallstreetbets-and-robinhood-created-bonkers-stock-market,GME
392,3-Feb-21,GameStop Rebounds After New Hires Spark Turnaround Optimism,By Katherine Burton and Sridhar Natarajan,markets,https://www.bloomberg.com/news/articles/2021-02-03/gamestop-rebounds-after-new-hires-spark-turnaround-optimism,GME
393,5-Feb-21,Businessweek Extra-Webull CEO Anthony Denier (Podcast),By Lu Wang,business,https://www.bloomberg.com/news/audio/2021-02-05/businessweek-extra-webull-ceo-anthony-denier-podcast,GME
394,3-Feb-21,GameStop Roller Coaster Pauses After $27 Billion Rout,By Anna Baraulina,wealth,https://www.bloomberg.com/news/articles/2021-02-03/gamestop-s-giant-bubble-deflates-further-after-27-billion-rout,GME
395,7-Feb-21,Reddit WallStreetBets Movement Was 15 Years in the Making,By Eric Balchunas and Joel Weber,markets,https://www.bloomberg.com/news/articles/2021-02-07/reddit-wallstreetbets-movement-was-15-years-in-the-making,GME
396,4-Feb-21,A Battle for Control of WallStreetBets May Have Broken Out,By Yakob Peterseil,wealth,https://www.bloomberg.com/news/articles/2021-02-04/a-battle-for-control-of-wallstreetbets-may-have-broken-out,GME
397,3-Feb-21,Citadel’s Link to the GameStop Stock Market Frenzy,By Colin Keatinge,markets,https://www.bloomberg.com/news/videos/2021-02-03/citadel-s-link-to-the-gamestop-stock-market-frenzy-video,GME
398,3-Feb-21,"GameStop, AMC Frenzy Was Bigger Than U.S. Oil Market, RBC Says",By Adrian Kennedy,markets,https://www.bloomberg.com/news/articles/2021-02-03/gamestop-amc-frenzy-was-bigger-than-u-s-oil-market-rbc-says,GME
399,8-Feb-21,"EV Company With Almost No Revenue Posts 3,000% Gain in 8 Months",By Tracy Alloway and Joe Weisenthal,markets,https://www.bloomberg.com/news/articles/2021-02-08/there-s-a-3-000-ev-stock-rally-that-makes-tesla-s-look-meager,GME
400,7-Feb-21,Peloton (PTON) Is Desperate to Overcome Its Supply Chain Woes,By Edward Johnson,business,https://www.bloomberg.com/news/newsletters/2021-02-07/peloton-pton-is-desperate-to-overcome-its-supply-chain-woes,GME
401,4-Feb-21,There Are Still 16 Meme Stocks With at Least 100% Gains in 2021,By Tom Hancock,markets,https://www.bloomberg.com/news/articles/2021-02-04/there-are-still-16-meme-stocks-with-at-least-100-gains-in-2021,GME
402,3-Feb-21,Goldman Sachs Goes to Supreme Court; Hedge Funds Won on GameStop,By David Fickling,business,https://www.bloomberg.com/news/newsletters/2021-02-03/goldman-sachs-goes-to-supreme-court-hedge-funds-won-on-gamestop,GME
403,2-Feb-21,GameStop Trade Was a Mixed Bag for Robinhood,By Brandon Kochkodin,opinion,https://www.bloomberg.com/opinion/articles/2021-02-02/gamestop-trade-was-a-mixed-bag-for-robinhood,GME
404,4-Feb-21,Robinhood Points to Stock Settlement Times as a Wall Street Risk,"By Benjamin Bain, Claire Ballentine, Yalman Onaran, and Sarah Ponczek",markets,https://www.bloomberg.com/news/videos/2021-02-04/robinhood-points-to-stock-settlement-times-as-a-market-risk-video,GME
405,7-Feb-21,Super Bowl Commercials Lean Into the Nostalgia: Ad Update,By Adam Haigh and Rita Nazareth,business,https://www.bloomberg.com/news/articles/2021-02-07/super-bowl-marketing-blitz-celebrates-2020-s-demise-ad-update,GME
406,6-Feb-21,New York Is Calling the Next Young and Ambitious Office Workers,By Claire Ballentine and Eddie van der Walt,opinion,https://www.bloomberg.com/opinion/articles/2021-02-06/new-york-is-calling-the-next-young-and-ambitious-office-workers-kktq6bmv,GME
407,3-Feb-21,"Hedge Funds Hunt Frothy Names to Short, Even After GameStop",By Donald Moore,markets,https://www.bloomberg.com/news/articles/2021-02-03/hedge-funds-hunt-frothy-valuations-to-short-even-after-gamestop,GME
408,2-Feb-21,GameStop Trade Was a Mixed Bag for Robinhood,By Joe Deaux,business,https://www.bloomberg.com/news/newsletters/2021-02-02/gamestop-trade-was-a-mixed-bag-for-robinhood-kko942ux,GME
409,3-Feb-21,GameStop (GME) Saga Is Also the Federal Reserve's Fault,By Lu Wang and Melissa Karsh,opinion,https://www.bloomberg.com/opinion/articles/2021-02-03/gamestop-gme-saga-is-also-the-federal-reserve-s-fault,GME
410,2-Feb-21,How an Army of Reddit Day Traders Sent GameStop Surging,By Matt Robinson and Sridhar Natarajan,markets,https://www.bloomberg.com/news/videos/2021-02-02/how-an-army-of-reddit-day-traders-sent-gamestop-surging-video,GME
411,6-Feb-21,Benchmark’s Bill Gurley Takes Aim at Latest IPO Gains,"By Misyrlena Egkolfopoulou, Suzanne Woolley, and Lisa Fleisher",technology,https://www.bloomberg.com/news/articles/2021-02-06/benchmark-s-bill-gurley-takes-aim-at-spacs,GME
412,2-Feb-21,Warren Wants Robinhood to Explain GameStop Trading Restrictions,By Christopher Condon,politics,https://www.bloomberg.com/news/articles/2021-02-02/warren-wants-robinhood-to-explain-gamestop-trading-restrictions,GME
413,2-Feb-21,Robinhood Customers Not Really Behind GameStop Craze: Ritholtz,By Tony Czuczka and Gregory Calderone,markets,https://www.bloomberg.com/news/videos/2021-02-02/robinhood-customers-not-really-behind-gamestop-craze-ritholtz-video,GME
414,5-Feb-21,"Bloomberg Wall Street Week: Capito, Palmisano, Mallaby(Podcast)",By Daniel Taub,business,https://www.bloomberg.com/news/audio/2021-02-05/bloomberg-wall-street-week-capito-palmisano-mallaby-podcast,GME
415,5-Feb-21,Reddit Documents a Surge of New Users to Site and WallStreetBets,By Brooke Sample,technology,https://www.bloomberg.com/news/articles/2021-02-05/reddit-documents-a-surge-of-new-users-to-site-and-wallstreetbets,GME
416,5-Feb-21,"Philippine Bourse’s Short Selling Plan to Proceed, Chief Says",By Erik Schatzker,markets,https://www.bloomberg.com/news/articles/2021-02-05/philippine-bourse-s-short-selling-plan-to-proceed-chief-says,GME
417,2-Feb-21,"Gamestop an ‘Irrelevant, Made for TV Storyline': Ritholtz",By Annie Massa and Sarah Ponczek,business,https://www.bloomberg.com/news/videos/2021-02-02/gamestop-a-minor-fascinating-but-irrelevant-made-for-tv-storyline-ritholtz-video,GME
418,2-Feb-21,GameStop Extends Drop as Short Interest and Volume Sink,By Mark Gilbert,technology,https://www.bloomberg.com/news/articles/2021-02-02/gamestop-extends-pullback-with-short-interest-and-volume-sinking,GME
420,3-Feb-21,Clearinghouses Are Intended to Reduce Risk. They Can Amplify It.,By Scott Duke Kominers,businessweek,https://www.bloomberg.com/news/articles/2021-02-03/clearinghouses-are-intended-to-reduce-risk-they-can-amplify-it,GME
421,6-Feb-21,Robinhood’s Collateral-Crunch Explanation Puzzles Wall Street,By Lu Wang,markets,https://www.bloomberg.com/news/articles/2021-02-06/robinhood-s-collateral-crunch-explanation-puzzles-wall-street,GME
422,2-Feb-21,"Mudrick Capital Gains $200 Million on AMC, GameStop in Wild Week","By Bei Hu, Melissa Karsh, and David Ramli",markets,https://www.bloomberg.com/news/articles/2021-02-02/mudrick-capital-gains-200-million-on-amc-gamestop-in-wild-week,GME
423,2-Feb-21,Is the GameStop Trade Really a Political Rebellion?,By Claire Ballentine,wealth,https://www.bloomberg.com/news/articles/2021-02-02/is-the-gamestop-trade-really-a-political-rebellion,GME
424,5-Feb-21,Biden's $1.9 Trillion Covid Relief Plan Isn't Too Big,"By Heejin Kim, Abhishek Vishnoi, and Youkyung Lee",opinion,https://www.bloomberg.com/opinion/articles/2021-02-05/biden-s-1-9-trillion-covid-relief-plan-isn-t-too-big,GME
425,2-Feb-21,Why the GameStop Frenzy Is Mostly a Made in U.S.A. Drama for Now,"By Nishant Kumar, Hema Parmar, and Katherine Burton",markets,https://www.bloomberg.com/news/articles/2021-02-02/why-the-gamestop-frenzy-is-mostly-a-made-in-u-s-a-drama-for-now,GME
426,5-Feb-21,Macro Man Vs. YOLO Boy (Podcast),By Brooke Sample,business,https://www.bloomberg.com/news/audio/2021-02-05/macro-man-vs-yolo-boy-podcast,GME
427,3-Feb-21,"Balance of Power: Stimulus, Gamestop Saga, 5G , China (Podcast)",By Michael Heath,business,https://www.bloomberg.com/news/audio/2021-02-03/balance-of-power-stimulus-gamestop-saga-5g-china-podcast,GME
428,5-Feb-21,SNB Held U.S. Stocks Worth a Record $141 Billion Last Year,By Devon Pendleton,markets,https://www.bloomberg.com/news/articles/2021-02-05/snb-held-u-s-stocks-worth-a-record-141-billion-last-year,GME
429,5-Feb-21,"Only 15% of Bitcoin Traders Are Women, Broker Study Shows",By Richard Cookson,technology,https://www.bloomberg.com/news/articles/2021-02-05/only-15-of-bitcoin-traders-are-women-broker-study-shows,GME
430,1-Feb-21,"Koreans Buy Tesla, GameStop as Foreign Stock Buying Hits Record",By Zoe Schneeweiss,wealth,https://www.bloomberg.com/news/articles/2021-02-01/koreans-buy-tesla-gamestop-as-foreign-stock-buying-hits-record,GME
431,1-Feb-21,GameStop Frenzy Shows ‘Important’ Policy Issues for Congress,By Lorcan Roche Kelly,politics,https://www.bloomberg.com/news/articles/2021-02-01/gamestop-frenzy-shows-important-policy-issues-for-congress,GME
432,2-Feb-21,"Reddit Trades Crumble as GameStop, AMC and Silver Plunge",By Michael Winfrey,wealth,https://www.bloomberg.com/news/articles/2021-02-02/reddit-trades-crumble-as-gamestop-amc-and-silver-plunge,GME
433,2-Feb-21,GameStop Frenzy Is Lost in Translation for Japan’s Day Traders,By Lorcan Roche Kelly,technology,https://www.bloomberg.com/news/articles/2021-02-03/gamestop-frenzy-is-lost-in-translation-for-japan-s-day-traders,GME
434,1-Feb-21,GameStop (GME) Is Old News After Reddit Discovers Silver Futures,By Michael Winfrey,opinion,https://www.bloomberg.com/opinion/articles/2021-02-01/gamestop-gme-is-old-news-after-reddit-discovers-silver-futures,GME
435,2-Feb-21,Hard to Replicate GameStop Squeeze In Silver: Rhind (Radio),By Ranjeetha Pakiam,business,https://www.bloomberg.com/news/audio/2021-02-02/hard-to-replicate-gamestop-squeeze-in-silver-rhind-radio-kkoekeo0,GME
436,1-Feb-21,GameStop Short Interest Plummets in a Sign Traders Are Covering,By Adam Haigh and Rita Nazareth,markets,https://www.bloomberg.com/news/articles/2021-02-01/gamestop-short-interest-plummets-in-a-sign-traders-are-covering,GME
437,1-Feb-21,"GameStop Sinks as Shorts Interest Drops, Retail Looks Elsewhere",By Jordan Fabian,markets,https://www.bloomberg.com/news/articles/2021-02-01/gamestop-sinks-as-shorts-interest-drops-retail-looks-elsewhere,GME
438,5-Feb-21,Kraus Says No One Should Be Surprised by a Market Plunge of 15%,By Mohamed Aly El-Erian,wealth,https://www.bloomberg.com/news/articles/2021-02-05/kraus-says-no-one-should-be-surprised-by-a-market-plunge-of-15,GME
439,1-Feb-21,GameStop (GME) Is Old News After Reddit Discovers Silver Futures,By Luke McGrath and Brandon Kochkodin,business,https://www.bloomberg.com/news/newsletters/2021-02-01/gamestop-gme-is-old-news-after-reddit-discovers-silver-futures-kkmtv8bh,GME
440,5-Feb-21,Clover Health Stock: Chamath Palihapitiya Faces Some Awkward Questions,By Misyrlena Egkolfopoulou and Sarah Ponczek,opinion,https://www.bloomberg.com/opinion/articles/2021-02-05/clover-health-stock-chamath-palihapitiya-faces-some-awkward-questions,GME
441,3-Feb-21,"U.S. Day Traders Mostly Male and Under 35, Cardify Finds: Chart",By Brian Chappatta,markets,https://www.bloomberg.com/news/articles/2021-02-03/u-s-day-traders-mostly-male-and-under-35-cardify-finds-chart,GME
442,2-Feb-21,Wall Street Didn't See Reddit's WallStreetBets Coming for GameStop (GME),By Harry Wilson and Ellen Milligan,opinion,https://www.bloomberg.com/opinion/articles/2021-02-02/wall-street-didn-t-see-reddit-s-wallstreetbets-coming-for-gamestop-gme,GME
443,1-Feb-21,House Financial Services Panel Sets GameStop Hearing for Feb. 18,By Sybilla Gross and Tracy Alloway,politics,https://www.bloomberg.com/news/articles/2021-02-02/house-financial-services-panel-sets-gamestop-hearing-for-feb-18,GME
444,6-Feb-21,"Market Chaos, Biden’s Shift and Putin’s Triumph: Weekend Reads",By Andreea Papuc and Tracy Alloway,politics,https://www.bloomberg.com/news/newsletters/2021-02-06/market-chaos-biden-s-shift-and-putin-s-triumph-weekend-reads,GME
445,1-Feb-21,GameStop Holds Onto Gains With Curbs Easing on Reddit Favorites,By Joe Weisenthal and Tracy Alloway,wealth,https://www.bloomberg.com/news/articles/2021-02-01/gamestop-holds-onto-gains-with-curbs-easing-on-reddit-favorites,GME
446,4-Feb-21,Yellen Finds Market Infrastructure ‘Resilient’ Amid Frenzy,By Hema Parmar and Melissa Karsh,markets,https://www.bloomberg.com/news/articles/2021-02-04/treasury-says-core-market-infrastructure-resilient-amid-frenzy,GME
447,5-Feb-21,Facebook's Oversight Board Is a Useful Flak-Catcher,By Katherine Greifeld and Claire Ballentine,opinion,https://www.bloomberg.com/opinion/articles/2021-02-05/facebook-s-oversight-board-is-a-useful-flak-catcher,GME
448,2-Feb-21,Moonshot Stocks Lose $167 Billion as Crowd Preaches Defiance,By Richard Miller,wealth,https://www.bloomberg.com/news/articles/2021-02-02/moonshot-stocks-lose-167-billion-as-crowd-preaches-defiance,GME
450,6-Feb-21,Reddit Boom-and-Bust Shines Light on European Market Bubble Risk,By Adam Haigh and Rita Nazareth,markets,https://www.bloomberg.com/news/articles/2021-02-06/reddit-boom-and-bust-shines-light-on-european-market-bubble-risk,GME
451,1-Feb-21,Your Evening Briefing: GameStop Bears Head for Their Dens,By Margaret Sutherlin,business,https://www.bloomberg.com/news/newsletters/2021-02-01/your-evening-briefing-gamestop-bears-head-for-their-dens,GME
452,2-Feb-21,Gamestop Not a Single Phenomenon: Capital Link's McGonegal,By Mark Gongloff,business,https://www.bloomberg.com/news/videos/2021-02-02/capital-link-s-mcgonegal-gamestop-not-a-single-phenomenon-video,GME
453,5-Feb-21,Death Threats and Hate Force Hedge Funds to Step Up Security,By Benjamin Bain,wealth,https://www.bloomberg.com/news/articles/2021-02-05/death-threats-and-hate-force-hedge-funds-to-step-up-security,GME
454,4-Feb-21,Baystate Business: Maine Rockets (Radio),By Brad Stone,business,https://www.bloomberg.com/news/audio/2021-02-04/baystate-business-maine-rockets-radio,GME
455,1-Feb-21,GameStop Short Squeeze Tactics May Not Be as Effective With AMC,By Mark Gongloff,opinion,https://www.bloomberg.com/opinion/articles/2021-02-01/gamestop-short-squeeze-tactics-may-not-be-as-effective-with-amc,GME
456,3-Feb-21,Yellen Summons Regulators to Discuss Financial Market Volatility,By Venus Feng,politics,https://www.bloomberg.com/news/articles/2021-02-03/yellen-summons-regulators-to-discuss-financial-market-volatility,GME
457,5-Feb-21,Cathie Wood Amasses $50 Billion and a New Nickname: ‘Money Tree’,By Brandon Kochkodin,markets,https://www.bloomberg.com/news/articles/2021-02-05/cathie-wood-amasses-50-billion-and-a-new-nickname-money-tree,GME
458,1-Feb-21,Buy Silver After GameStop (GME) Surge? Reddit Mania Could Be Investment Risk,By Jarrell Dillard,wealth,https://www.bloomberg.com/news/articles/2021-02-01/should-you-buy-silver-xag-after-gamestop-gme-reddit-mania-could-be-risk,GME
459,1-Feb-21,Is The GameStop Trade Really A Political Rebellion? (Podcast),By Suzannah Cavanaugh,business,https://www.bloomberg.com/news/audio/2021-02-01/is-the-gamestop-trade-really-a-political-rebellion-podcast,GME
460,1-Feb-21,Fed’s Kashkari Says He’s Not Fazed by GameStop Trading Frenzy,By Benjamin Stupples and Anders Melin,markets,https://www.bloomberg.com/news/articles/2021-02-01/fed-s-kashkari-says-he-s-not-fazed-by-gamestop-trading-frenzy,GME
461,4-Feb-21,Five Things You Need to Know to Start Your Day,By Matthew S Levine,business,https://www.bloomberg.com/news/newsletters/2021-02-04/five-things-you-need-to-know-to-start-your-day-kkrim33l,GME
462,1-Feb-21,GameStop (GME) Short Squeeze Inflicts Lasting Pain on Hedge Funds,By Kit Rees,opinion,https://www.bloomberg.com/opinion/articles/2021-02-01/gamestop-gme-short-squeeze-inflicts-lasting-pain-on-hedge-funds,GME
463,2-Feb-21,"Amazon's Bezos Stepping Down 'Makes Total Sense', Says Estimize CEO",By Katherine Greifeld,technology,https://www.bloomberg.com/news/videos/2021-02-03/amazon-s-bezos-stepping-down-makes-total-sense-says-estimize-ceo-video,GME
464,2-Feb-21,Crypto Pump And Dumps Aim Small Amid Speculative Trading Frenzy,By Luke McGrath,technology,https://www.bloomberg.com/news/articles/2021-02-02/crypto-pump-dumps-aim-small-amid-speculative-trading-frenzy,GME
465,3-Feb-21,Macquarie's Shvets: Fundamental Shift on How Markets Operate,By Claire Ballentine,business,https://www.bloomberg.com/news/videos/2021-02-03/macquarie-s-shvets-fundamental-shift-on-how-markets-operate-video,GME
466,4-Feb-21,Goldman's Jeff Currie on the Silver Squeeze and the Coming Boom in Commodities,By Eddie Spence,markets,https://www.bloomberg.com/news/articles/2021-02-04/goldman-s-jeff-currie-on-the-silver-squeeze-and-the-coming-boom-in-commodities,GME
467,4-Feb-21,"Reddit Traders May Help Markets in Long Run, Canaccord CEO Says",By Sam Unsted,markets,https://www.bloomberg.com/news/articles/2021-02-04/reddit-traders-may-help-markets-in-long-run-canaccord-ceo-says,GME
468,5-Feb-21,"Stock Markets Today: Vaccination Rates, Reddit Frenzy Lessons, Oil Prices Rising",By Annie Massa,markets,https://www.bloomberg.com/news/newsletters/2021-02-05/stock-markets-today-vaccination-rates-reddit-frenzy-lessons-oil-prices-rising,GME
469,1-Feb-21,"Robinhood Blocked GameStop (GME), AMC, Blackberry (BB): How Much Investors Lost",By Rosalind Mathieson,business,https://www.bloomberg.com/graphics/2021-robinhood-trading-limit/,GME
