Unnamed: 0,Date,Headline,Author,Eyebrow,Link,Stock
0,16-Mar-21,GameStop Slides Again Amid Wild Ride for Retail Traders,By Bailey Lipschultz,markets,https://www.bloomberg.com/news/articles/2021-03-16/gamestop-shares-slump-again-amid-wild-ride-for-retail-traders,GME
1,16-Mar-21,Bill Gross Says He Made Millions Shorting GameStop,By Brandon Kochkodin and Pierre Paulden,markets,https://www.bloomberg.com/news/videos/2021-03-16/bill-gross-says-he-made-millions-shorting-gamestop-video,GME
2,16-Mar-21,Bill Gross Says He Made $10 Million Betting Against GameStop,By Erik Schatzker and Daniela Sirtori-Cortina,wealth,https://www.bloomberg.com/news/articles/2021-03-16/bill-gross-says-he-made-10-million-betting-against-gamestop,GME
3,16-Mar-21,"Bill Gross Surprises With Short Bets on Treasuries, GameStop",By Lucas Shaw,wealth,https://www.bloomberg.com/news/articles/2021-03-16/bill-gross-says-he-s-short-treasuries-expecting-3-4-inflation,GME
4,16-Mar-21,WallStreetBets’ Founder Goes to Hollywood With His GameStop Tale,By Matthew Leising,pursuits,https://www.bloomberg.com/news/articles/2021-03-16/wallstreetbets-founder-goes-to-hollywood-with-his-gamestop-tale,GME
5,16-Mar-21,NYSE Chairman Says GameStop Surge Highlights U.S. Market Flaws,By Bailey Lipschultz,markets,https://www.bloomberg.com/news/articles/2021-03-16/nyse-chairman-says-gamestop-surge-highlights-u-s-market-flaws,GME
6,15-Mar-21,GameStop Roller-Coaster Hits Bump as Trading Volume Dries Up,By Matthew S Levine,markets,https://www.bloomberg.com/news/articles/2021-03-15/gamestop-reverses-gains-to-slide-16-triggering-volatility-halt,GME
7,16-Mar-21,"Gamestop Phenomenon Wont Happen in India, Broker Says",By Bailey Lipschultz,business,https://www.bloomberg.com/news/videos/2021-03-16/gamestop-phenomenon-wont-happen-in-india-broker-says-video,GME
8,15-Mar-21,Goldman Sachs CEO David Solomon Wants His Bankers Back at the Office,By David Rovella,opinion,https://www.bloomberg.com/opinion/articles/2021-03-15/goldman-sachs-ceo-david-solomon-wants-his-bankers-back-at-the-office,GME
9,12-Mar-21,GameStop Soars for a Third Week as Retail Traders Trump Bears,By Ruth Carson and Livia Yap,markets,https://www.bloomberg.com/news/articles/2021-03-12/gamestop-coasts-toward-100-weekly-gain-defying-gravity-again,GME
10,16-Mar-21,Your Evening Briefing: U.S. Says Putin Tried to Tilt 2020 Election,By Donald Moore and Emily Cadman,business,https://www.bloomberg.com/news/newsletters/2021-03-16/your-evening-briefing-u-s-says-putin-tried-to-tilt-2020-election,GME
11,16-Mar-21,"BlackRock, Lombard Say Calls for Faster Inflation Are Premature",By Brandon Kochkodin,markets,https://www.bloomberg.com/news/articles/2021-03-17/blackrock-lombard-say-calls-for-faster-inflation-are-premature,GME
12,12-Mar-21,"GameStop (GME), Roblox (RBLX), Greensill, Coal: Investments in the Spotlight",By Matthew S Levine,wealth,https://www.bloomberg.com/news/articles/2021-03-12/gamestop-gme-roblox-rblx-greensill-coal-investments-in-the-spotlight,GME
13,11-Mar-21,"During GameStop Halts, AMC Becomes a Bellwether for Day Traders","By Charlie Wells, Suzanne Woolley, and Katharine Gemmell",markets,https://www.bloomberg.com/news/articles/2021-03-11/during-gamestop-halts-amc-becomes-a-bellwether-for-day-traders,GME
14,15-Mar-21,Goldman Sachs CEO David Solomon Wants His Bankers Back at the Office,By Paul Jarvis,business,https://www.bloomberg.com/news/newsletters/2021-03-15/goldman-sachs-ceo-david-solomon-wants-his-bankers-back-at-the-office-kmasw2xe,GME
15,16-Mar-21,"Biden Stimulus Check $1,400: Best Investment Ideas, Save or Spend Stimmy",By David Rovella,wealth,https://www.bloomberg.com/news/articles/2021-03-16/biden-stimulus-check-1-400-best-investment-ideas-save-or-spend-it,GME
16,11-Mar-21,GameStop’s Latest Drop Signals No End to Its Extreme Volatility,By Matthew S Levine,technology,https://www.bloomberg.com/news/articles/2021-03-11/gamestop-drops-with-no-sign-of-end-to-stock-s-extreme-volatility,GME
17,10-Mar-21,The Roller-Coaster Day for GameStop Shares,By Paul Jarvis,markets,https://www.bloomberg.com/news/videos/2021-03-10/the-roller-coaster-day-for-gamestop-shares-video,GME
18,15-Mar-21,Your Evening Briefing: Worrying Signs as Covid Transmission Rates Jump,By Olga Kharif,business,https://www.bloomberg.com/news/newsletters/2021-03-15/your-evening-briefing-worrying-signs-as-covid-transmission-rates-jump,GME
19,11-Mar-21,Roblox and Coupang Chose Their Initial Investors,By Bailey Lipschultz,opinion,https://www.bloomberg.com/opinion/articles/2021-03-11/roblox-and-coupang-chose-their-initial-investors,GME
20,10-Mar-21,GameStop’s Win Streak Keeps Going Amid Cohen Shakeup Plan,By Kamaron Leach and Bailey Lipschultz,markets,https://www.bloomberg.com/news/articles/2021-03-10/gamestop-s-winning-streak-keeps-going-amid-cohen-shakeup-plan,GME
21,14-Mar-21,Crypto’s Next Big Thing Raises Questions While the Price Surges,By Benjamin Bain,markets,https://www.bloomberg.com/news/articles/2021-03-14/crypto-s-next-big-thing-raises-questions-while-the-price-surges,GME
22,9-Mar-21,GameStop Defies Gravity Again With Rally Nearing 100% Gain,By Brian Chappatta,markets,https://www.bloomberg.com/news/articles/2021-03-09/gamestop-defies-gravity-again-with-rally-heading-for-100-gain,GME
23,10-Mar-21,"Interest Rates Narrative 'Overblown,' Tallbacken CEO Says",By Matthew S Levine,technology,https://www.bloomberg.com/news/videos/2021-03-10/interest-rates-narrative-overblown-tallbacken-ceo-says-video,GME
24,13-Mar-21,‘Stimmy’ Is Setting Stage for Next Wave of Retail Stock Frenzy,By Eric Lam,markets,https://www.bloomberg.com/news/articles/2021-03-13/-stimmy-is-setting-stage-for-next-wave-of-retail-stock-frenzy,GME
25,9-Mar-21,"GameStop Prompts U.S. to Consider New Rules for Options, Shorts",By Gearoid Reidy and Shoko Oda,markets,https://www.bloomberg.com/news/articles/2021-03-09/gamestop-prompts-u-s-to-consider-new-rules-for-options-shorts,GME
26,9-Mar-21,"GameStop Is Soaring Again, But Why Aren’t Its Bonds?",By Bailey Lipschultz,opinion,https://www.bloomberg.com/opinion/articles/2021-03-09/gamestop-is-soaring-again-but-why-aren-t-its-bonds,GME
27,9-Mar-21,SEC Goes After Analyst Foreshadowing,By Scott Deveau,opinion,https://www.bloomberg.com/opinion/articles/2021-03-09/sec-goes-after-analyst-foreshadowing,GME
28,13-Mar-21,"Banned from Bitcoin Posts, WallStreetBets Turns to Crypto Miners",By Daniel Avis,markets,https://www.bloomberg.com/news/articles/2021-03-13/banned-from-bitcoin-posts-wallstreetbets-turns-to-crypto-miners,GME
29,12-Mar-21,Trader Arrested as WallStreetBets Phenomenon Finds Echo in Japan,By Matthew S Levine,markets,https://www.bloomberg.com/news/articles/2021-03-12/trader-arrested-as-wallstreetbets-phenomenon-finds-echo-in-japan,GME
30,8-Mar-21,GameStop Mania Returns With Chewy’s Cohen Leading E-Commerce Bid,By Matthew S Levine,markets,https://www.bloomberg.com/news/articles/2021-03-08/gamestop-mania-returns-with-chewy-s-cohen-leading-e-commerce-bid,GME
31,8-Mar-21,GameStop Taps Chewy.com’s Cohen to Lead E-Commerce Shift,By Andrew Mach,technology,https://www.bloomberg.com/news/articles/2021-03-08/gamestop-said-to-tap-chewy-com-s-cohen-to-lead-e-commerce-shift,GME
32,9-Mar-21,S3 Partners' Rankings for Short Crowding and Squeezes,By Joe Easton,markets,https://www.bloomberg.com/news/videos/2021-03-09/s3-partners-rankings-for-short-crowding-and-squeezes-video,GME
33,9-Mar-21,"Warren Says ‘Big Sharks’ Citadel, Robinhood Prey on Customers",By Benjamin Robertson,politics,https://www.bloomberg.com/news/articles/2021-03-09/warren-says-sharks-citadel-robinhood-profit-off-of-customers,GME
34,11-Mar-21,Roblox and Coupang Chose Their Initial Investors,"By Christopher Condon, Saleha Mohsin, and Jesse Hamilton",business,https://www.bloomberg.com/news/newsletters/2021-03-11/roblox-and-coupang-chose-their-initial-investors-km55bn85,GME
35,8-Mar-21,Libor Is Going Away for Real,By Bailey Lipschultz,opinion,https://www.bloomberg.com/opinion/articles/2021-03-08/libor-is-going-away-for-real,GME
36,11-Mar-21,Weekly Watchlist: Biden's Stimulus Becomes Law a Year Into the Pandemic,By Annie Massa and Emily Chang,business,https://www.bloomberg.com/news/newsletters/2021-03-11/weekly-watchlist-biden-s-stimulus-becomes-law-a-year-into-the-pandemic,GME
37,11-Mar-21,IG Group Stock Trading Revenue Jumps 600% Amid Reddit Frenzy,By Cristin Flanagan,business,https://www.bloomberg.com/news/articles/2021-03-11/ig-group-stock-trading-revenue-jumps-600-amid-reddit-frenzy,GME
38,11-Mar-21,Tax Trades? How Much? This Idea Makes Traders Flinch: QuickTake,By Matthew S Levine,markets,https://www.bloomberg.com/news/articles/2021-03-11/who-taxes-financial-transactions-and-will-others-join-quicktake,GME
39,11-Mar-21,Biden Treasury Pick Quietly Starts Work to Rein In Wall Street,By David Rovella,politics,https://www.bloomberg.com/news/articles/2021-03-11/biden-treasury-pick-quietly-starts-work-to-rein-in-wall-street,GME
40,10-Mar-21,Reddit Plays Soar as Earnings Give Fundamental Boost to Rallies,By Michael Bellusci,markets,https://www.bloomberg.com/news/articles/2021-03-10/reddit-plays-soar-as-earnings-give-fundamental-boost-to-rallies,GME
41,10-Mar-21,Robinhood CEO Rebukes Critics in Call for Ubiquitous Investing,By Gary Shilling,markets,https://www.bloomberg.com/news/articles/2021-03-10/robinhood-ceo-rebukes-critics-in-call-for-ubiquitous-investing,GME
42,9-Mar-21,Meme Share Revival Drives Volume Surge in Tiny Stocks,By Mark Gongloff,markets,https://www.bloomberg.com/news/articles/2021-03-09/meme-stock-revival-drives-millions-of-trades-in-tiny-stocks,GME
43,9-Mar-21,Money Stuff: SEC Goes After Analyst Foreshadowing,By Matthew S Levine,business,https://www.bloomberg.com/news/newsletters/2021-03-09/money-stuff-sec-goes-after-analyst-foreshadowing,GME
44,9-Mar-21,Your Evening Briefing: Study Says Pfizer-BioNTech Shot Works on Variants,By Matthew S Levine,business,https://www.bloomberg.com/news/newsletters/2021-03-09/your-evening-briefing-study-says-pfizer-biontech-shot-works-on-variants,GME
45,5-Mar-21,Timely GameStop Sale Lifts Senvest Hedge Fund to 60% Return,By Charlie Wells,markets,https://www.bloomberg.com/news/articles/2021-03-05/timely-gamestop-sale-lifts-senvest-hedge-fund-to-60-return,GME
46,10-Mar-21,The Coming Economic Boom Will Be Just a Mirage,By Lukas Strobl,opinion,https://www.bloomberg.com/opinion/articles/2021-03-10/the-coming-economic-boom-will-be-just-a-mirage,GME
47,9-Mar-21,"Microsoft, SolarWinds Hacks Expose Cyber Defense Weaknesses",By John Authers,opinion,https://www.bloomberg.com/opinion/articles/2021-03-09/microsoft-solarwinds-hacks-expose-cyber-defense-weaknesses,GME
48,10-Mar-21,Money Stuff: Citi Is Still Mad About That $500 Million,By Zheping Huang,business,https://www.bloomberg.com/news/newsletters/2021-03-10/money-stuff-citi-is-still-mad-about-that-500-million,GME
49,10-Mar-21,Citi Is Still Mad About That $500 Million,By Bailey Lipschultz,opinion,https://www.bloomberg.com/opinion/articles/2021-03-10/citi-is-still-mad-about-that-500-million,GME
50,10-Mar-21,"SPAC Stocks: Chamath Palihapitiya, Richard Branson, A-Rod Now Joined by Even Mom",By Barry L Ritholtz,wealth,https://www.bloomberg.com/news/articles/2021-03-10/spac-stock-buzz-billionaire-richard-branson-s-vgac-deal-spurs-mom-to-buy-shares,GME
51,10-Mar-21,"Stock Markets Today: Camera hack, Covid pass, Citi's revenge",By Matthew S Levine,markets,https://www.bloomberg.com/news/newsletters/2021-03-10/stock-markets-today-camera-hack-covid-pass-citi-s-revenge,GME
52,10-Mar-21,The Tech Stocks Rebound Is a Dinosaur Brain Event,By Matthew S Levine,opinion,https://www.bloomberg.com/opinion/articles/2021-03-10/the-tech-stocks-rebound-is-a-dinosaur-brain-event,GME
53,9-Mar-21,"Clubhorse, Clubchat and Clubtalk: China's Clubhouse Copycats",By Lorcan Roche Kelly,business,https://www.bloomberg.com/news/newsletters/2021-03-09/clubhorse-clubchat-and-clubtalk-china-s-clubhouse-copycats,GME
54,4-Mar-21,GameStop Bucks Market’s Slump Amid Renewed Reddit Chatter,By Matthew S Levine,markets,https://www.bloomberg.com/news/articles/2021-03-04/gamestop-bucks-market-s-slump-amid-renewed-reddit-chatter,GME
55,9-Mar-21,Wall Street Hype Has Evolved Since the Dot-Com Era,By Chris Bryant,opinion,https://www.bloomberg.com/opinion/articles/2021-03-09/wall-street-hype-has-evolved-since-the-dot-com-era,GME
56,4-Mar-21,Melvin Capital Improves From GameStop Reddit Struggle,By Katherine Burton and Hema Parmar,business,https://www.bloomberg.com/news/newsletters/2021-03-04/melvin-capital-improves-from-gamestop-reddit-struggle-klv55zta,GME
57,4-Mar-21,Melvin Capital Improves From GameStop Reddit Struggle,By Heather Perlberg,opinion,https://www.bloomberg.com/opinion/articles/2021-03-04/melvin-capital-improves-from-gamestop-reddit-struggle,GME
58,9-Mar-21,Five Things You Need to Know to Start Your Day,By Michelle Leder,markets,https://www.bloomberg.com/news/newsletters/2021-03-09/five-things-you-need-to-know-to-start-your-day,GME
59,8-Mar-21,Money Stuff: Libor Is Going Away for Real,By Brandon Kochkodin and Erik Schatzker,business,https://www.bloomberg.com/news/newsletters/2021-03-08/money-stuff-libor-is-going-away-for-real,GME
60,3-Mar-21,Sen. Warren Wants Full Investigation of GameStop,By Matthew Brooker,markets,https://www.bloomberg.com/news/videos/2021-03-03/sen-warren-wants-full-investigation-of-gamestop-video,GME
61,4-Mar-21,Melvin Capital Dusts Off GameStop Saga,By Matthew S Levine,business,https://www.bloomberg.com/news/videos/2021-03-04/melvin-capital-dusts-off-gamestop-saga-video,GME
62,8-Mar-21,SPAC Party Over? $CCIV Dive and Chamath Palihapitiya SPCE Sale Say So,By Jackie Edwards,opinion,https://www.bloomberg.com/opinion/articles/2021-03-08/spac-party-over-cciv-dive-and-chamath-palihapitiya-spce-sale-say-so,GME
63,3-Mar-21,Melvin Capital Surged 22% in February After GameStop Disaster,By Mark Gongloff,markets,https://www.bloomberg.com/news/articles/2021-03-03/melvin-capital-surged-22-in-february-after-gamestop-disaster,GME
64,8-Mar-21,Are SPACs a Good Investment? Inside the Stock Market's Looming SPAC Bubble,By Brody Ford,wealth,https://www.bloomberg.com/news/features/2021-03-08/are-spacs-a-good-investment-inside-the-stock-market-s-looming-spac-bubble,GME
65,8-Mar-21,Roblox Picked a Great Time to Go Public,By Michael Tobin and Katherine Burton,opinion,https://www.bloomberg.com/opinion/articles/2021-03-08/roblox-picked-a-great-time-to-go-public,GME
66,6-Mar-21,The Biggest Players in the Short-Selling Game Are Getting a Pass,By Matthew S Levine,markets,https://www.bloomberg.com/news/articles/2021-03-06/the-biggest-players-in-the-short-selling-game-are-getting-a-pass,GME
67,6-Mar-21,Stock Bubbles Can Be Useful as Long as Bankers Are Kept Out,By Claire Ballentine and Vildana Hajric,opinion,https://www.bloomberg.com/opinion/articles/2021-03-07/stock-bubbles-can-be-useful-as-long-as-bankers-are-kept-out,GME
68,3-Mar-21,Citi Won’t Misplace $500 Million Again,By Donald Moore and Emily Cadman,opinion,https://www.bloomberg.com/opinion/articles/2021-03-03/citi-won-t-misplace-500-million-again,GME
69,3-Mar-21,"Australian Came for Reddit Gainer, Stays for Long-Term Growth","By Annie Massa, Robert Schmidt, and Misyrlena Egkolfopoulou",markets,https://www.bloomberg.com/news/articles/2021-03-03/australian-came-for-reddit-gainer-stays-for-long-term-growth,GME
70,2-Mar-21,"Bitcoin ($BTC), GameStop ($GME) Are More Cults Than Investments",By Matt Robinson and Prashant Gopal,opinion,https://www.bloomberg.com/opinion/articles/2021-03-02/bitcoin-btc-gamestop-gme-are-more-cults-than-investments,GME
71,5-Mar-21,"Reddit Takes Step Toward Eventual IPO, Naming Vollero First CFO",By Shoko Oda,technology,https://www.bloomberg.com/news/articles/2021-03-05/reddit-takes-step-toward-eventual-ipo-naming-vollero-first-cfo,GME
72,4-Mar-21,Energy Hedge Fund Deep Basin Returning Capital After Retail Rout,By Suzanne Woolley,markets,https://www.bloomberg.com/news/articles/2021-03-04/energy-hedge-fund-deep-basin-returning-capital-after-retail-rout,GME
73,1-Mar-21,Are Bond ETFs Creating a Bond Market Liquidity Illusion?,By Zheping Huang,opinion,https://www.bloomberg.com/opinion/articles/2021-03-01/are-bond-etfs-creating-a-bond-market-liquidity-illusion,GME
74,4-Mar-21,Portnoy-Backed ETF Ranks Among Most Active Debuts on Record,By Joe Easton,markets,https://www.bloomberg.com/news/articles/2021-03-04/dave-portnoy-backed-etf-ranks-among-top-debuts-in-its-first-hour,GME
75,5-Mar-21,"VanEck Vectors Social ETF (BUZZ), Michaels (MIK), Deliveroo: Investment Bets","By Paul Jarvis, Suzannah Cavanaugh, and Felice Maranz",wealth,https://www.bloomberg.com/news/articles/2021-03-05/vaneck-vectors-social-etf-buzz-michaels-mik-deliveroo-investment-bets,GME
76,3-Mar-21,Robinhood Weighs Scrapping Its Confetti Animation After Scrutiny,By Nishant Kumar,wealth,https://www.bloomberg.com/news/articles/2021-03-03/robinhood-weighs-scrapping-its-confetti-animation-after-scrutiny,GME
77,4-Mar-21,Why Wall Street Nemesis William Galvin Is Suing Robinhood,By David Rovella,businessweek,https://www.bloomberg.com/news/articles/2021-03-04/why-wall-street-nemesis-william-galvin-is-suing-robinhood,GME
78,1-Mar-21,The Newest Meme Stock Might Be Shares in the Bank of Japan,By Matthew S Levine,business,https://www.bloomberg.com/news/articles/2021-03-01/the-newest-meme-stock-might-be-shares-in-the-bank-of-japan,GME
79,3-Mar-21,Robinhood Traders Must Heed Charlie Munger’s Warning on Stock Trading: Bernstein,By Claire Ballentine,wealth,https://www.bloomberg.com/news/articles/2021-03-03/robinhood-traders-must-heed-charlie-munger-s-warning-on-stock-trading-bernstein,GME
80,3-Mar-21,Renegade Crypto Exchange Turns to Mainstream CEO for a Makeover,By Benjamin Bain and Robert Schmidt,technology,https://www.bloomberg.com/news/articles/2021-03-04/renegade-crypto-exchange-turns-to-mainstream-ceo-for-a-makeover,GME
81,4-Mar-21,Stock Markets Today: Ireland row; stocks decline; hedge fund comeback,By Divya Balji and Bailey Lipschultz,markets,https://www.bloomberg.com/news/newsletters/2021-03-04/stock-markets-today-ireland-row-stocks-decline-hedge-fund-comeback,GME
82,3-Mar-21,Rocket Extends Surge to Fourth Day as New Day-Trader Favorite,By Steven T. Dennis and Kevin Cirilli,markets,https://www.bloomberg.com/news/articles/2021-03-03/rocket-extends-four-day-109-surge-as-new-day-trader-favorite,GME
83,2-Mar-21,Man Group Has a Message for Reddit Rookies: We’re Watching You,By Peter Coy,markets,https://www.bloomberg.com/news/articles/2021-03-02/man-group-has-a-message-for-reddit-rookies-we-re-watching-you,GME
84,3-Mar-21,Evening Briefing Newsletter: India’s Controversial Vaccine Measures Up,By Steven Church,business,https://www.bloomberg.com/news/newsletters/2021-03-03/evening-briefing-newsletter-india-s-controversial-vaccine-measures-up,GME
85,2-Mar-21,Senate Vetting Biden's Choice for SEC Head Amid Stock Drama,By Misyrlena Egkolfopoulou,politics,https://www.bloomberg.com/news/articles/2021-03-02/senate-vetting-biden-s-choice-for-sec-head-amid-stock-drama,GME
86,3-Mar-21,Money Stuff: Citi Won’t Misplace $500 Million Again,By James Tarmy,business,https://www.bloomberg.com/news/newsletters/2021-03-03/money-stuff-citi-won-t-misplace-500-million-again,GME
87,2-Mar-21,A New ETF Named BUZZ Wants to Ride the Reddit-Trading Revolution,By Rebecca Kern,markets,https://www.bloomberg.com/news/articles/2021-03-02/a-new-etf-named-buzz-wants-to-ride-the-reddit-trading-revolution,GME
88,2-Mar-21,Gensler Targets Broker ‘Gamification’ After Trading Tumult,By Emily Cadman and Donald Moore,politics,https://www.bloomberg.com/news/articles/2021-03-02/gensler-says-scrutinizing-trading-apps-would-be-focus-at-sec,GME
89,26-Feb-21,Reddit Frenzy Boosts GameStop Shares in Best Week Since January,By Nir Kaissar,markets,https://www.bloomberg.com/news/articles/2021-02-26/reddit-frenzy-boosts-gamestop-shares-in-best-week-since-january,GME
90,2-Mar-21,Warren Backs More Audits for Rich as Part of Wealth Tax Plan,By Elena Popina,politics,https://www.bloomberg.com/news/articles/2021-03-02/warren-backs-more-audits-for-rich-as-part-of-wealth-tax-plan,GME
91,2-Mar-21,Seven Ways to Trick Yourself Into Making Sound Financial Choices,By Matthew S Levine,businessweek,https://www.bloomberg.com/news/articles/2021-03-02/seven-ways-to-trick-yourself-into-making-sound-financial-choices,GME
92,2-Mar-21,"Hertz, the Original Meme Stock, Is Turning Out to Be Worthless",By Lorcan Roche Kelly,markets,https://www.bloomberg.com/news/articles/2021-03-02/hertz-the-original-meme-stock-is-turning-out-to-be-worthless,GME
93,26-Feb-21,"GameStop (GME): Robinhood Users Who Got Free Stock Display 9,000% Gains, Regret",By Sarah McBride,wealth,https://www.bloomberg.com/news/articles/2021-02-26/gamestop-gme-robinhood-users-who-got-free-stock-display-9-000-gains-regret,GME
94,2-Mar-21,NFT Art Boom Is the Same Concept as the Photography Market,By Katherine Greifeld,businessweek,https://www.bloomberg.com/news/articles/2021-03-02/nft-art-boom-is-the-same-concept-as-the-photography-market,GME
95,25-Feb-21,GameStop Is Making Progress Under Ryan Cohen: Rod Alzmann,By Matthew S Levine,business,https://www.bloomberg.com/news/videos/2021-02-25/gamestop-is-making-progress-under-ryan-cohen-rod-alzmann-video,GME
96,3-Mar-21,"Section 230, Tech’s Liability Shield, Under Fire: Here’s a Guide to the Debate",By Matthew S Levine,politics,https://www.bloomberg.com/news/articles/2021-03-03/section-230-tech-s-liability-shield-under-fire-here-s-a-guide-to-the-debate,GME
97,26-Feb-21,"GameStop (GME), Airbnb (ABNB), Tesla (TSLA), Ark ETFs (ARKK): Investments Bets","By Benjamin Bain, Daniel Avis, and Robert Schmidt",wealth,https://www.bloomberg.com/news/articles/2021-02-26/gamestop-gme-airbnb-abnb-tesla-tsla-ark-etfs-arkk-investments-bets,GME
98,25-Feb-21,GameStop Leads Meme Stock Mania on Wall Street,By Michelle Leder,technology,https://www.bloomberg.com/news/videos/2021-02-25/gamestop-leads-meme-stock-mania-on-wall-street-video,GME
99,2-Mar-21,Personal Finance: Bitcoin Tips Scales in Favor of a U.S. ETF,By Michelle Leder,opinion,https://www.bloomberg.com/opinion/articles/2021-03-02/personal-finance-bitcoin-tips-scales-in-favor-of-a-u-s-etf,GME
100,25-Feb-21,GameStop Options Bet That the Stock Will Reach $800 on Friday,By Matthew Monks and Katie Roof,markets,https://www.bloomberg.com/news/articles/2021-02-25/gamestop-options-bet-that-the-stock-will-reach-800-on-friday,GME
101,25-Feb-21,GameStop Is Happening Again,By Mark Gongloff,opinion,https://www.bloomberg.com/opinion/articles/2021-02-25/gamestop-is-happening-again,GME
102,2-Mar-21,Five Things You Need to Know to Start Your Day,By Joe Nocera,markets,https://www.bloomberg.com/news/newsletters/2021-03-02/five-things-you-need-to-know-to-start-your-day,GME
103,2-Mar-21,Clubhouse App Faces Next Challenge: Growing Beyond Silicon Valley,By Matthew S Levine,businessweek,https://www.bloomberg.com/news/articles/2021-03-02/clubhouse-app-faces-next-challenge-growing-beyond-silicon-valley,GME
104,25-Feb-21,ETF That Lost 80% of Assets in GameStop Drama Faces New Turmoil,By David Rovella,markets,https://www.bloomberg.com/news/articles/2021-02-25/fund-that-lost-80-of-assets-in-gamestop-drama-faces-new-turmoil,GME
105,25-Feb-21,Money Stuff: GameStop Is Happening Again,By Sarah Ponczek,business,https://www.bloomberg.com/news/newsletters/2021-02-25/money-stuff-gamestop-is-happening-again,GME
106,1-Mar-21,Are Bond ETFs Creating a Bond Market Liquidity Illusion?,By Justina Lee,business,https://www.bloomberg.com/news/newsletters/2021-03-01/are-bond-etfs-creating-a-bond-market-liquidity-illusion-klqv0h1w,GME
107,1-Mar-21,Wall Street Is Set to Learn How Tough Biden’s Watchdogs Will Be,By John Authers,politics,https://www.bloomberg.com/news/articles/2021-03-01/wall-street-is-set-to-learn-how-tough-biden-s-watchdogs-will-be,GME
108,25-Feb-21,GameStop Is Back! Meme Stock Mania Kicks Up Anew,By Katherine Greifeld and Sarah Ponczek,business,https://www.bloomberg.com/news/videos/2021-02-25/gamestop-shares-surge-as-meme-stock-mania-kicks-up-anew-video,GME
110,2-Mar-21,Repeat IPOs Offer More Evidence of Market Froth,By Rob Golum,opinion,https://www.bloomberg.com/opinion/articles/2021-03-02/repeat-ipos-offer-more-evidence-of-market-froth,GME
111,26-Feb-21,Robinhood Said to Plan Confidential IPO Filing as Soon as March,By Anders Melin,markets,https://www.bloomberg.com/news/articles/2021-02-27/robinhood-said-to-plan-confidential-ipo-filing-as-soon-as-march,GME
112,25-Feb-21,"Bitcoin ($BTC), GameStop ($GME) Ignore Bond Market Meltdown",By Jennifer Bissell-Linsk and Aoyon Ashraf,opinion,https://www.bloomberg.com/opinion/articles/2021-02-25/bitcoin-gamestop-ignore-bond-market-meltdown,GME
113,25-Feb-21,Dot-Com Survivors Have Wisdom for the GameStop Crowd,By Sarah Ponczek and Michael P Regan,opinion,https://www.bloomberg.com/graphics/2021-opinion-personal-finance-dot-com-survivors-have-wisdom-for-gamestop-crowd/,GME
114,25-Feb-21,The Vaccine Is Not a Competition,By Matthew S Levine,opinion,https://www.bloomberg.com/opinion/articles/2021-02-24/the-vaccine-is-not-a-competition,GME
115,1-Mar-21,Your Evening Briefing: New York City Covid Variant Triggers New Worry,By Misyrlena Egkolfopoulou,business,https://www.bloomberg.com/news/newsletters/2021-03-01/your-evening-briefing-new-york-city-covid-variant-triggers-new-worry,GME
116,24-Feb-21,Day-Trading Bag Holders Get Unlikely Reprieve in GameStop Rally,By Lu Wang and Vildana Hajric,markets,https://www.bloomberg.com/news/articles/2021-02-24/gamestop-delivers-unlikely-reprieve-to-day-trading-bag-holders,GME
117,1-Mar-21,A $300 Billion Quant Trade Wins in ‘Almost Unbelievable’ Market,By Stuart Trow,markets,https://www.bloomberg.com/news/articles/2021-03-01/a-300-billion-quant-trade-wins-in-almost-unbelievable-market,GME
